13:25:07.882036 68:a3:c4:4e:2c:bd > 8c:be:be:38:d8:fd, ethertype IPv6 (0x86dd), length 86: fe80::6aa3:c4ff:fe4e:2cbd > fe80::a0f4:73ff:fed3:fa74: ICMP6, neighbor solicitation, who has fe80::a0f4:73ff:fed3:fa74, length 32
13:25:07.883325 8c:be:be:38:d8:fd > 68:a3:c4:4e:2c:bd, ethertype IPv6 (0x86dd), length 78: fe80::a0f4:73ff:fed3:fa74 > fe80::6aa3:c4ff:fe4e:2cbd: ICMP6, neighbor advertisement, tgt is fe80::a0f4:73ff:fed3:fa74, length 24
13:25:12.885506 8c:be:be:38:d8:fd > 68:a3:c4:4e:2c:bd, ethertype IPv6 (0x86dd), length 86: fe80::a0f4:73ff:fed3:fa74 > fe80::6aa3:c4ff:fe4e:2cbd: ICMP6, neighbor solicitation, who has fe80::6aa3:c4ff:fe4e:2cbd, length 32
13:25:12.885562 68:a3:c4:4e:2c:bd > 8c:be:be:38:d8:fd, ethertype IPv6 (0x86dd), length 78: fe80::6aa3:c4ff:fe4e:2cbd > fe80::a0f4:73ff:fed3:fa74: ICMP6, neighbor advertisement, tgt is fe80::6aa3:c4ff:fe4e:2cbd, length 24
13:25:14.787612 8c:be:be:38:d8:fd > 68:a3:c4:4e:2c:bd, ethertype IPv4 (0x0800), length 183: 157.240.16.16.443 > 192.168.43.197.40616: Flags [P.], seq 1366911956:1366912073, ack 2907274987, win 1121, options [nop,nop,TS val 2271969400 ecr 6456993], length 117
13:25:14.787674 68:a3:c4:4e:2c:bd > 8c:be:be:38:d8:fd, ethertype IPv4 (0x0800), length 66: 192.168.43.197.40616 > 157.240.16.16.443: Flags [.], ack 117, win 1444, options [nop,nop,TS val 6465206 ecr 2271969400], length 0
13:25:14.833416 68:a3:c4:4e:2c:bd > 8c:be:be:38:d8:fd, ethertype IPv4 (0x0800), length 344: 192.168.43.197.40616 > 157.240.16.16.443: Flags [P.], seq 1:279, ack 117, win 1444, options [nop,nop,TS val 6465217 ecr 2271969400], length 278
13:25:14.936358 8c:be:be:38:d8:fd > 68:a3:c4:4e:2c:bd, ethertype IPv4 (0x0800), length 108: 157.240.16.16.443 > 192.168.43.197.40616: Flags [P.], seq 117:159, ack 279, win 1131, options [nop,nop,TS val 2271969549 ecr 6465217], length 42
13:25:14.936415 68:a3:c4:4e:2c:bd > 8c:be:be:38:d8:fd, ethertype IPv4 (0x0800), length 66: 192.168.43.197.40616 > 157.240.16.16.443: Flags [.], ack 159, win 1444, options [nop,nop,TS val 6465243 ecr 2271969549], length 0
13:25:19.795300 8c:be:be:38:d8:fd > 68:a3:c4:4e:2c:bd, ethertype ARP (0x0806), length 42: Request who-has 192.168.43.197 tell 192.168.43.1, length 28
13:25:19.795351 68:a3:c4:4e:2c:bd > 8c:be:be:38:d8:fd, ethertype ARP (0x0806), length 42: Reply 192.168.43.197 is-at 68:a3:c4:4e:2c:bd, length 28
13:25:20.318310 8c:be:be:38:d8:fd > 68:a3:c4:4e:2c:bd, ethertype IPv4 (0x0800), length 723: 157.240.16.16.443 > 192.168.43.197.40616: Flags [P.], seq 159:816, ack 279, win 1131, options [nop,nop,TS val 2271974927 ecr 6465243], length 657
13:25:20.318383 68:a3:c4:4e:2c:bd > 8c:be:be:38:d8:fd, ethertype IPv4 (0x0800), length 66: 192.168.43.197.40616 > 157.240.16.16.443: Flags [.], ack 816, win 1444, options [nop,nop,TS val 6466589 ecr 2271974927], length 0
13:25:20.319126 8c:be:be:38:d8:fd > 68:a3:c4:4e:2c:bd, ethertype IPv4 (0x0800), length 806: 157.240.16.16.443 > 192.168.43.197.40616: Flags [P.], seq 816:1556, ack 279, win 1131, options [nop,nop,TS val 2271974928 ecr 6465243], length 740
13:25:20.319152 68:a3:c4:4e:2c:bd > 8c:be:be:38:d8:fd, ethertype IPv4 (0x0800), length 66: 192.168.43.197.40616 > 157.240.16.16.443: Flags [.], ack 1556, win 1444, options [nop,nop,TS val 6466589 ecr 2271974928], length 0
13:25:20.524726 68:a3:c4:4e:2c:bd > 8c:be:be:38:d8:fd, ethertype IPv4 (0x0800), length 323: 192.168.43.197.40616 > 157.240.16.16.443: Flags [P.], seq 279:536, ack 1556, win 1444, options [nop,nop,TS val 6466640 ecr 2271974928], length 257
13:25:20.624191 8c:be:be:38:d8:fd > 68:a3:c4:4e:2c:bd, ethertype IPv4 (0x0800), length 108: 157.240.16.16.443 > 192.168.43.197.40616: Flags [P.], seq 1556:1598, ack 536, win 1142, options [nop,nop,TS val 2271975237 ecr 6466640], length 42
13:25:20.624223 68:a3:c4:4e:2c:bd > 8c:be:be:38:d8:fd, ethertype IPv4 (0x0800), length 66: 192.168.43.197.40616 > 157.240.16.16.443: Flags [.], ack 1598, win 1444, options [nop,nop,TS val 6466665 ecr 2271975237], length 0
13:25:21.358023 68:a3:c4:4e:2c:bd > 8c:be:be:38:d8:fd, ethertype IPv4 (0x0800), length 112: 192.168.43.197.34350 > 172.217.24.99.443: Flags [P.], seq 2951763958:2951764004, ack 1030481228, win 1444, options [nop,nop,TS val 6466849 ecr 49001670], length 46
13:25:21.494495 8c:be:be:38:d8:fd > 68:a3:c4:4e:2c:bd, ethertype IPv4 (0x0800), length 112: 172.217.24.99.443 > 192.168.43.197.34350: Flags [P.], seq 1:47, ack 46, win 958, options [nop,nop,TS val 49060287 ecr 6466849], length 46
13:25:21.494576 68:a3:c4:4e:2c:bd > 8c:be:be:38:d8:fd, ethertype IPv4 (0x0800), length 66: 192.168.43.197.34350 > 172.217.24.99.443: Flags [.], ack 47, win 1444, options [nop,nop,TS val 6466883 ecr 49060287], length 0
13:25:25.360000 68:a3:c4:4e:2c:bd > 8c:be:be:38:d8:fd, ethertype IPv4 (0x0800), length 112: 192.168.43.197.34350 > 172.217.24.99.443: Flags [P.], seq 46:92, ack 47, win 1444, options [nop,nop,TS val 6467849 ecr 49060287], length 46
13:25:25.388417 68:a3:c4:4e:2c:bd > 8c:be:be:38:d8:fd, ethertype IPv4 (0x0800), length 97: 192.168.43.197.34350 > 172.217.24.99.443: Flags [P.], seq 92:123, ack 47, win 1444, options [nop,nop,TS val 6467856 ecr 49060287], length 31
13:25:25.388463 68:a3:c4:4e:2c:bd > 8c:be:be:38:d8:fd, ethertype IPv4 (0x0800), length 66: 192.168.43.197.34350 > 172.217.24.99.443: Flags [F.], seq 123, ack 47, win 1444, options [nop,nop,TS val 6467856 ecr 49060287], length 0
13:25:25.522614 8c:be:be:38:d8:fd > 68:a3:c4:4e:2c:bd, ethertype IPv4 (0x0800), length 66: 172.217.24.99.443 > 192.168.43.197.34350: Flags [.], ack 92, win 958, options [nop,nop,TS val 49064327 ecr 6467849], length 0
13:25:25.522659 8c:be:be:38:d8:fd > 68:a3:c4:4e:2c:bd, ethertype IPv4 (0x0800), length 78: 172.217.24.99.443 > 192.168.43.197.34350: Flags [.], ack 92, win 958, options [nop,nop,TS val 49064328 ecr 6467849,nop,nop,sack 1 {123:124}], length 0
13:25:25.522679 8c:be:be:38:d8:fd > 68:a3:c4:4e:2c:bd, ethertype IPv4 (0x0800), length 66: 172.217.24.99.443 > 192.168.43.197.34350: Flags [.], ack 124, win 958, options [nop,nop,TS val 49064328 ecr 6467856], length 0
13:25:25.522708 8c:be:be:38:d8:fd > 68:a3:c4:4e:2c:bd, ethertype IPv4 (0x0800), length 66: 172.217.24.99.443 > 192.168.43.197.34350: Flags [F.], seq 47, ack 124, win 958, options [nop,nop,TS val 49064328 ecr 6467856], length 0
13:25:25.522744 68:a3:c4:4e:2c:bd > 8c:be:be:38:d8:fd, ethertype IPv4 (0x0800), length 66: 192.168.43.197.34350 > 172.217.24.99.443: Flags [.], ack 48, win 1444, options [nop,nop,TS val 6467890 ecr 49064328], length 0
13:25:28.811334 68:a3:c4:4e:2c:bd > 8c:be:be:38:d8:fd, ethertype IPv4 (0x0800), length 84: 192.168.43.197.2485 > 192.168.43.1.53: 56936+ A? 5-edge-chat.facebook.com. (42)
13:25:28.811478 68:a3:c4:4e:2c:bd > 8c:be:be:38:d8:fd, ethertype IPv4 (0x0800), length 84: 192.168.43.197.60734 > 192.168.43.1.53: 60236+ AAAA? 5-edge-chat.facebook.com. (42)
13:25:28.818691 68:a3:c4:4e:2c:bd > 8c:be:be:38:d8:fd, ethertype IPv4 (0x0800), length 388: 192.168.43.197.40616 > 157.240.16.16.443: Flags [P.], seq 536:858, ack 1598, win 1444, options [nop,nop,TS val 6468714 ecr 2271975237], length 322
13:25:28.861900 8c:be:be:38:d8:fd > 68:a3:c4:4e:2c:bd, ethertype IPv4 (0x0800), length 124: 192.168.43.1.53 > 192.168.43.197.2485: 56936 2/0/0 CNAME star.c10r.facebook.com., A 157.240.16.16 (82)
13:25:28.861938 8c:be:be:38:d8:fd > 68:a3:c4:4e:2c:bd, ethertype IPv4 (0x0800), length 136: 192.168.43.1.53 > 192.168.43.197.60734: 60236 2/0/0 CNAME star.c10r.facebook.com., AAAA 2a03:2880:f02f:f:face:b00c:0:2 (94)
13:25:28.894642 8c:be:be:38:d8:fd > 68:a3:c4:4e:2c:bd, ethertype IPv4 (0x0800), length 108: 157.240.16.16.443 > 192.168.43.197.40616: Flags [P.], seq 1598:1640, ack 858, win 1153, options [nop,nop,TS val 2271983508 ecr 6468714], length 42
13:25:28.894678 68:a3:c4:4e:2c:bd > 8c:be:be:38:d8:fd, ethertype IPv4 (0x0800), length 66: 192.168.43.197.40616 > 157.240.16.16.443: Flags [.], ack 1640, win 1444, options [nop,nop,TS val 6468733 ecr 2271983508], length 0
13:25:29.094938 8c:be:be:38:d8:fd > 68:a3:c4:4e:2c:bd, ethertype IPv4 (0x0800), length 176: 157.240.16.16.443 > 192.168.43.197.40616: Flags [P.], seq 1640:1750, ack 858, win 1153, options [nop,nop,TS val 2271983708 ecr 6468733], length 110
13:25:29.094978 68:a3:c4:4e:2c:bd > 8c:be:be:38:d8:fd, ethertype IPv4 (0x0800), length 66: 192.168.43.197.40616 > 157.240.16.16.443: Flags [.], ack 1750, win 1444, options [nop,nop,TS val 6468783 ecr 2271983708], length 0
13:25:29.138426 8c:be:be:38:d8:fd > 68:a3:c4:4e:2c:bd, ethertype IPv4 (0x0800), length 1424: 157.240.16.16.443 > 192.168.43.197.40616: Flags [.], seq 1750:3108, ack 858, win 1153, options [nop,nop,TS val 2271983749 ecr 6468733], length 1358
13:25:29.138478 68:a3:c4:4e:2c:bd > 8c:be:be:38:d8:fd, ethertype IPv4 (0x0800), length 66: 192.168.43.197.40616 > 157.240.16.16.443: Flags [.], ack 3108, win 1444, options [nop,nop,TS val 6468794 ecr 2271983749], length 0
13:25:29.142965 8c:be:be:38:d8:fd > 68:a3:c4:4e:2c:bd, ethertype IPv4 (0x0800), length 1424: 157.240.16.16.443 > 192.168.43.197.40616: Flags [.], seq 3108:4466, ack 858, win 1153, options [nop,nop,TS val 2271983749 ecr 6468733], length 1358
13:25:29.143012 68:a3:c4:4e:2c:bd > 8c:be:be:38:d8:fd, ethertype IPv4 (0x0800), length 66: 192.168.43.197.40616 > 157.240.16.16.443: Flags [.], ack 4466, win 1444, options [nop,nop,TS val 6468795 ecr 2271983749], length 0
13:25:29.143062 8c:be:be:38:d8:fd > 68:a3:c4:4e:2c:bd, ethertype IPv4 (0x0800), length 408: 157.240.16.16.443 > 192.168.43.197.40616: Flags [.], seq 4466:4808, ack 858, win 1153, options [nop,nop,TS val 2271983749 ecr 6468733], length 342
13:25:29.143078 68:a3:c4:4e:2c:bd > 8c:be:be:38:d8:fd, ethertype IPv4 (0x0800), length 66: 192.168.43.197.40616 > 157.240.16.16.443: Flags [.], ack 4808, win 1444, options [nop,nop,TS val 6468795 ecr 2271983749], length 0
13:25:29.144480 8c:be:be:38:d8:fd > 68:a3:c4:4e:2c:bd, ethertype IPv4 (0x0800), length 1177: 157.240.16.16.443 > 192.168.43.197.40616: Flags [P.], seq 4808:5919, ack 858, win 1153, options [nop,nop,TS val 2271983749 ecr 6468733], length 1111
13:25:29.144504 68:a3:c4:4e:2c:bd > 8c:be:be:38:d8:fd, ethertype IPv4 (0x0800), length 66: 192.168.43.197.40616 > 157.240.16.16.443: Flags [.], ack 5919, win 1444, options [nop,nop,TS val 6468795 ecr 2271983749], length 0
13:25:29.144545 8c:be:be:38:d8:fd > 68:a3:c4:4e:2c:bd, ethertype IPv4 (0x0800), length 561: 157.240.16.16.443 > 192.168.43.197.40616: Flags [P.], seq 5919:6414, ack 858, win 1153, options [nop,nop,TS val 2271983749 ecr 6468733], length 495
13:25:29.144562 68:a3:c4:4e:2c:bd > 8c:be:be:38:d8:fd, ethertype IPv4 (0x0800), length 66: 192.168.43.197.40616 > 157.240.16.16.443: Flags [.], ack 6414, win 1444, options [nop,nop,TS val 6468795 ecr 2271983749], length 0
13:25:29.145971 8c:be:be:38:d8:fd > 68:a3:c4:4e:2c:bd, ethertype IPv4 (0x0800), length 1424: 157.240.16.16.443 > 192.168.43.197.40616: Flags [.], seq 6414:7772, ack 858, win 1153, options [nop,nop,TS val 2271983749 ecr 6468733], length 1358
13:25:29.145997 68:a3:c4:4e:2c:bd > 8c:be:be:38:d8:fd, ethertype IPv4 (0x0800), length 66: 192.168.43.197.40616 > 157.240.16.16.443: Flags [.], ack 7772, win 1444, options [nop,nop,TS val 6468796 ecr 2271983749], length 0
13:25:29.160120 8c:be:be:38:d8:fd > 68:a3:c4:4e:2c:bd, ethertype IPv4 (0x0800), length 1424: 157.240.16.16.443 > 192.168.43.197.40616: Flags [.], seq 7772:9130, ack 858, win 1153, options [nop,nop,TS val 2271983749 ecr 6468733], length 1358
13:25:29.160164 68:a3:c4:4e:2c:bd > 8c:be:be:38:d8:fd, ethertype IPv4 (0x0800), length 66: 192.168.43.197.40616 > 157.240.16.16.443: Flags [.], ack 9130, win 1444, options [nop,nop,TS val 6468799 ecr 2271983749], length 0
13:25:29.178167 68:a3:c4:4e:2c:bd > 8c:be:be:38:d8:fd, ethertype IPv4 (0x0800), length 341: 192.168.43.197.40616 > 157.240.16.16.443: Flags [P.], seq 858:1133, ack 9130, win 1444, options [nop,nop,TS val 6468804 ecr 2271983749], length 275
13:25:29.179693 8c:be:be:38:d8:fd > 68:a3:c4:4e:2c:bd, ethertype IPv4 (0x0800), length 1424: 157.240.16.16.443 > 192.168.43.197.40616: Flags [.], seq 9130:10488, ack 858, win 1153, options [nop,nop,TS val 2271983749 ecr 6468733], length 1358
13:25:29.179735 8c:be:be:38:d8:fd > 68:a3:c4:4e:2c:bd, ethertype IPv4 (0x0800), length 459: 157.240.16.16.443 > 192.168.43.197.40616: Flags [P.], seq 10488:10881, ack 858, win 1153, options [nop,nop,TS val 2271983749 ecr 6468733], length 393
13:25:29.179752 68:a3:c4:4e:2c:bd > 8c:be:be:38:d8:fd, ethertype IPv4 (0x0800), length 66: 192.168.43.197.40616 > 157.240.16.16.443: Flags [.], ack 10881, win 1444, options [nop,nop,TS val 6468804 ecr 2271983749], length 0
13:25:29.251025 8c:be:be:38:d8:fd > 68:a3:c4:4e:2c:bd, ethertype IPv4 (0x0800), length 108: 157.240.16.16.443 > 192.168.43.197.40616: Flags [P.], seq 10881:10923, ack 1133, win 1163, options [nop,nop,TS val 2271983865 ecr 6468804], length 42
13:25:29.289968 68:a3:c4:4e:2c:bd > 8c:be:be:38:d8:fd, ethertype IPv4 (0x0800), length 66: 192.168.43.197.40616 > 157.240.16.16.443: Flags [.], ack 10923, win 1444, options [nop,nop,TS val 6468832 ecr 2271983865], length 0
13:25:29.507022 68:a3:c4:4e:2c:bd > 8c:be:be:38:d8:fd, ethertype IPv4 (0x0800), length 90: 192.168.43.197.48998 > 192.168.43.1.53: 32047+ A? scontent.fdel3-1.fna.fbcdn.net. (48)
13:25:29.553323 8c:be:be:38:d8:fd > 68:a3:c4:4e:2c:bd, ethertype IPv4 (0x0800), length 106: 192.168.43.1.53 > 192.168.43.197.48998: 32047 1/0/0 A 49.44.63.145 (64)
13:25:29.553598 68:a3:c4:4e:2c:bd > 8c:be:be:38:d8:fd, ethertype IPv4 (0x0800), length 90: 192.168.43.197.1770 > 192.168.43.1.53: 51628+ AAAA? scontent.fdel3-1.fna.fbcdn.net. (48)
13:25:29.558422 68:a3:c4:4e:2c:bd > 8c:be:be:38:d8:fd, ethertype IPv4 (0x0800), length 76: 192.168.43.197.35974 > 192.168.43.1.53: 38236+ A? www.facebook.com. (34)
13:25:29.558555 68:a3:c4:4e:2c:bd > 8c:be:be:38:d8:fd, ethertype IPv4 (0x0800), length 76: 192.168.43.197.54795 > 192.168.43.1.53: 34702+ AAAA? www.facebook.com. (34)
13:25:29.558623 68:a3:c4:4e:2c:bd > 8c:be:be:38:d8:fd, ethertype IPv4 (0x0800), length 272: 192.168.43.197.41204 > 31.13.78.35.443: Flags [P.], seq 1513931026:1513931232, ack 886417215, win 4885, options [nop,nop,TS val 6468899 ecr 2326678201], length 206
13:25:29.559102 68:a3:c4:4e:2c:bd > 8c:be:be:38:d8:fd, ethertype IPv4 (0x0800), length 661: 192.168.43.197.41204 > 31.13.78.35.443: Flags [P.], seq 206:801, ack 1, win 4885, options [nop,nop,TS val 6468899 ecr 2326678201], length 595
13:25:29.602091 8c:be:be:38:d8:fd > 68:a3:c4:4e:2c:bd, ethertype IPv4 (0x0800), length 118: 192.168.43.1.53 > 192.168.43.197.1770: 51628 1/0/0 AAAA 2405:200:160b:2885:face:b00c:0:a7 (76)
13:25:29.605402 8c:be:be:38:d8:fd > 68:a3:c4:4e:2c:bd, ethertype IPv4 (0x0800), length 121: 192.168.43.1.53 > 192.168.43.197.35974: 38236 2/0/0 CNAME star-mini.c10r.facebook.com., A 31.13.78.35 (79)
13:25:29.605426 8c:be:be:38:d8:fd > 68:a3:c4:4e:2c:bd, ethertype IPv4 (0x0800), length 133: 192.168.43.1.53 > 192.168.43.197.54795: 34702 2/0/0 CNAME star-mini.c10r.facebook.com., AAAA 2a03:2880:f126:83:face:b00c:0:25de (91)
13:25:29.634800 68:a3:c4:4e:2c:bd > 8c:be:be:38:d8:fd, ethertype IPv4 (0x0800), length 76: 192.168.43.197.13280 > 192.168.43.1.53: 6497+ A? www.facebook.com. (34)
13:25:29.634878 68:a3:c4:4e:2c:bd > 8c:be:be:38:d8:fd, ethertype IPv4 (0x0800), length 193: 192.168.43.197.41204 > 31.13.78.35.443: Flags [P.], seq 801:928, ack 1, win 4885, options [nop,nop,TS val 6468918 ecr 2326678201], length 127
13:25:29.634913 68:a3:c4:4e:2c:bd > 8c:be:be:38:d8:fd, ethertype IPv4 (0x0800), length 76: 192.168.43.197.31291 > 192.168.43.1.53: 19300+ AAAA? www.facebook.com. (34)
13:25:29.635220 68:a3:c4:4e:2c:bd > 8c:be:be:38:d8:fd, ethertype IPv4 (0x0800), length 638: 192.168.43.197.41204 > 31.13.78.35.443: Flags [P.], seq 928:1500, ack 1, win 4885, options [nop,nop,TS val 6468918 ecr 2326678201], length 572
13:25:29.636690 8c:be:be:38:d8:fd > 68:a3:c4:4e:2c:bd, ethertype IPv4 (0x0800), length 133: 192.168.43.1.53 > 192.168.43.197.13280: 6497 2/0/0 CNAME star-mini.c10r.facebook.com., A 31.13.78.35 (91)
13:25:29.671191 8c:be:be:38:d8:fd > 68:a3:c4:4e:2c:bd, ethertype IPv4 (0x0800), length 66: 31.13.78.35.443 > 192.168.43.197.41204: Flags [.], ack 206, win 2043, options [nop,nop,TS val 2326715395 ecr 6468899], length 0
13:25:29.671216 8c:be:be:38:d8:fd > 68:a3:c4:4e:2c:bd, ethertype IPv4 (0x0800), length 108: 31.13.78.35.443 > 192.168.43.197.41204: Flags [P.], seq 1:43, ack 206, win 2043, options [nop,nop,TS val 2326715395 ecr 6468899], length 42
13:25:29.671228 68:a3:c4:4e:2c:bd > 8c:be:be:38:d8:fd, ethertype IPv4 (0x0800), length 66: 192.168.43.197.41204 > 31.13.78.35.443: Flags [.], ack 43, win 4885, options [nop,nop,TS val 6468927 ecr 2326715395], length 0
13:25:29.685364 8c:be:be:38:d8:fd > 68:a3:c4:4e:2c:bd, ethertype IPv4 (0x0800), length 133: 192.168.43.1.53 > 192.168.43.197.31291: 19300 2/0/0 CNAME star-mini.c10r.facebook.com., AAAA 2a03:2880:f126:83:face:b00c:0:25de (91)
13:25:29.718179 8c:be:be:38:d8:fd > 68:a3:c4:4e:2c:bd, ethertype IPv4 (0x0800), length 66: 31.13.78.35.443 > 192.168.43.197.41204: Flags [.], ack 801, win 2043, options [nop,nop,TS val 2326715443 ecr 6468899], length 0
13:25:29.741406 8c:be:be:38:d8:fd > 68:a3:c4:4e:2c:bd, ethertype IPv4 (0x0800), length 66: 31.13.78.35.443 > 192.168.43.197.41204: Flags [.], ack 928, win 2043, options [nop,nop,TS val 2326715464 ecr 6468918], length 0
13:25:29.741432 8c:be:be:38:d8:fd > 68:a3:c4:4e:2c:bd, ethertype IPv4 (0x0800), length 108: 31.13.78.35.443 > 192.168.43.197.41204: Flags [P.], seq 43:85, ack 928, win 2043, options [nop,nop,TS val 2326715464 ecr 6468918], length 42
13:25:29.741443 68:a3:c4:4e:2c:bd > 8c:be:be:38:d8:fd, ethertype IPv4 (0x0800), length 66: 192.168.43.197.41204 > 31.13.78.35.443: Flags [.], ack 85, win 4885, options [nop,nop,TS val 6468944 ecr 2326715464], length 0
13:25:29.790079 8c:be:be:38:d8:fd > 68:a3:c4:4e:2c:bd, ethertype IPv4 (0x0800), length 66: 31.13.78.35.443 > 192.168.43.197.41204: Flags [.], ack 1500, win 2043, options [nop,nop,TS val 2326715515 ecr 6468918], length 0
13:25:29.854751 8c:be:be:38:d8:fd > 68:a3:c4:4e:2c:bd, ethertype IPv4 (0x0800), length 1202: 31.13.78.35.443 > 192.168.43.197.41204: Flags [P.], seq 85:1221, ack 1500, win 2043, options [nop,nop,TS val 2326715574 ecr 6468927], length 1136
13:25:29.854796 68:a3:c4:4e:2c:bd > 8c:be:be:38:d8:fd, ethertype IPv4 (0x0800), length 66: 192.168.43.197.41204 > 31.13.78.35.443: Flags [.], ack 1221, win 4885, options [nop,nop,TS val 6468973 ecr 2326715574], length 0
13:25:29.854828 8c:be:be:38:d8:fd > 68:a3:c4:4e:2c:bd, ethertype IPv4 (0x0800), length 203: 31.13.78.35.443 > 192.168.43.197.41204: Flags [P.], seq 1221:1358, ack 1500, win 2043, options [nop,nop,TS val 2326715574 ecr 6468927], length 137
13:25:29.854832 68:a3:c4:4e:2c:bd > 8c:be:be:38:d8:fd, ethertype IPv4 (0x0800), length 66: 192.168.43.197.41204 > 31.13.78.35.443: Flags [.], ack 1358, win 4885, options [nop,nop,TS val 6468973 ecr 2326715574], length 0
13:25:29.854840 8c:be:be:38:d8:fd > 68:a3:c4:4e:2c:bd, ethertype IPv4 (0x0800), length 105: 31.13.78.35.443 > 192.168.43.197.41204: Flags [P.], seq 1358:1397, ack 1500, win 2043, options [nop,nop,TS val 2326715575 ecr 6468927], length 39
13:25:29.854844 68:a3:c4:4e:2c:bd > 8c:be:be:38:d8:fd, ethertype IPv4 (0x0800), length 66: 192.168.43.197.41204 > 31.13.78.35.443: Flags [.], ack 1397, win 4885, options [nop,nop,TS val 6468973 ecr 2326715575], length 0
13:25:29.902525 68:a3:c4:4e:2c:bd > 8c:be:be:38:d8:fd, ethertype IPv4 (0x0800), length 216: 192.168.43.197.51430 > 49.44.63.145.443: Flags [P.], seq 4116538266:4116538416, ack 619147255, win 3765, options [nop,nop,TS val 6468985 ecr 774576311], length 150
13:25:29.907187 68:a3:c4:4e:2c:bd > 8c:be:be:38:d8:fd, ethertype IPv4 (0x0800), length 216: 192.168.43.197.51430 > 49.44.63.145.443: Flags [P.], seq 150:300, ack 1, win 3765, options [nop,nop,TS val 6468986 ecr 774576311], length 150
13:25:29.935028 8c:be:be:38:d8:fd > 68:a3:c4:4e:2c:bd, ethertype IPv4 (0x0800), length 1091: 31.13.78.35.443 > 192.168.43.197.41204: Flags [P.], seq 1397:2422, ack 1500, win 2043, options [nop,nop,TS val 2326715646 ecr 6468944], length 1025
13:25:29.935050 68:a3:c4:4e:2c:bd > 8c:be:be:38:d8:fd, ethertype IPv4 (0x0800), length 66: 192.168.43.197.41204 > 31.13.78.35.443: Flags [.], ack 2422, win 4885, options [nop,nop,TS val 6468993 ecr 2326715646], length 0
13:25:29.935071 8c:be:be:38:d8:fd > 68:a3:c4:4e:2c:bd, ethertype IPv4 (0x0800), length 105: 31.13.78.35.443 > 192.168.43.197.41204: Flags [P.], seq 2422:2461, ack 1500, win 2043, options [nop,nop,TS val 2326715646 ecr 6468944], length 39
13:25:29.935084 68:a3:c4:4e:2c:bd > 8c:be:be:38:d8:fd, ethertype IPv4 (0x0800), length 66: 192.168.43.197.41204 > 31.13.78.35.443: Flags [.], ack 2461, win 4885, options [nop,nop,TS val 6468993 ecr 2326715646], length 0
13:25:29.974706 8c:be:be:38:d8:fd > 68:a3:c4:4e:2c:bd, ethertype IPv4 (0x0800), length 108: 49.44.63.145.443 > 192.168.43.197.51430: Flags [P.], seq 1:43, ack 150, win 298, options [nop,nop,TS val 774610513 ecr 6468985], length 42
13:25:29.974739 68:a3:c4:4e:2c:bd > 8c:be:be:38:d8:fd, ethertype IPv4 (0x0800), length 66: 192.168.43.197.51430 > 49.44.63.145.443: Flags [.], ack 43, win 3765, options [nop,nop,TS val 6469003 ecr 774610513], length 0
13:25:29.983464 8c:be:be:38:d8:fd > 68:a3:c4:4e:2c:bd, ethertype IPv4 (0x0800), length 1344: 49.44.63.145.443 > 192.168.43.197.51430: Flags [P.], seq 43:1321, ack 150, win 298, options [nop,nop,TS val 774610517 ecr 6468985], length 1278
13:25:29.983488 68:a3:c4:4e:2c:bd > 8c:be:be:38:d8:fd, ethertype IPv4 (0x0800), length 66: 192.168.43.197.51430 > 49.44.63.145.443: Flags [.], ack 1321, win 3787, options [nop,nop,TS val 6469005 ecr 774610517], length 0
13:25:29.986491 8c:be:be:38:d8:fd > 68:a3:c4:4e:2c:bd, ethertype IPv4 (0x0800), length 108: 49.44.63.145.443 > 192.168.43.197.51430: Flags [P.], seq 1321:1363, ack 300, win 302, options [nop,nop,TS val 774610523 ecr 6468986], length 42
13:25:29.986516 68:a3:c4:4e:2c:bd > 8c:be:be:38:d8:fd, ethertype IPv4 (0x0800), length 66: 192.168.43.197.51430 > 49.44.63.145.443: Flags [.], ack 1363, win 3787, options [nop,nop,TS val 6469006 ecr 774610523], length 0
13:25:30.013681 8c:be:be:38:d8:fd > 68:a3:c4:4e:2c:bd, ethertype IPv4 (0x0800), length 210: 49.44.63.145.443 > 192.168.43.197.51430: Flags [P.], seq 1363:1507, ack 300, win 302, options [nop,nop,TS val 774610551 ecr 6468986], length 144
13:25:30.013705 68:a3:c4:4e:2c:bd > 8c:be:be:38:d8:fd, ethertype IPv4 (0x0800), length 66: 192.168.43.197.51430 > 49.44.63.145.443: Flags [.], ack 1507, win 3787, options [nop,nop,TS val 6469012 ecr 774610551], length 0
13:25:30.014806 8c:be:be:38:d8:fd > 68:a3:c4:4e:2c:bd, ethertype IPv4 (0x0800), length 1117: 49.44.63.145.443 > 192.168.43.197.51430: Flags [P.], seq 1507:2558, ack 300, win 302, options [nop,nop,TS val 774610551 ecr 6468986], length 1051
13:25:30.014821 68:a3:c4:4e:2c:bd > 8c:be:be:38:d8:fd, ethertype IPv4 (0x0800), length 66: 192.168.43.197.51430 > 49.44.63.145.443: Flags [.], ack 2558, win 3808, options [nop,nop,TS val 6469013 ecr 774610551], length 0
13:25:30.676507 68:a3:c4:4e:2c:bd > 8c:be:be:38:d8:fd, ethertype IPv4 (0x0800), length 90: 192.168.43.197.58602 > 192.168.43.1.53: 62667+ A? scontent.fdel1-1.fna.fbcdn.net. (48)
13:25:30.677599 68:a3:c4:4e:2c:bd > 8c:be:be:38:d8:fd, ethertype IPv4 (0x0800), length 629: 192.168.43.197.41204 > 31.13.78.35.443: Flags [P.], seq 1500:2063, ack 2461, win 4885, options [nop,nop,TS val 6469178 ecr 2326715646], length 563
13:25:30.694702 68:a3:c4:4e:2c:bd > 8c:be:be:38:d8:fd, ethertype IPv4 (0x0800), length 76: 192.168.43.197.53427 > 192.168.43.1.53: 40769+ A? www.facebook.com. (34)
13:25:30.694749 68:a3:c4:4e:2c:bd > 8c:be:be:38:d8:fd, ethertype IPv4 (0x0800), length 76: 192.168.43.197.52291 > 192.168.43.1.53: 31733+ AAAA? www.facebook.com. (34)
13:25:30.695025 68:a3:c4:4e:2c:bd > 8c:be:be:38:d8:fd, ethertype IPv4 (0x0800), length 414: 192.168.43.197.41204 > 31.13.78.35.443: Flags [P.], seq 2063:2411, ack 2461, win 4885, options [nop,nop,TS val 6469183 ecr 2326715646], length 348
13:25:30.695145 68:a3:c4:4e:2c:bd > 8c:be:be:38:d8:fd, ethertype IPv4 (0x0800), length 1424: 192.168.43.197.41204 > 31.13.78.35.443: Flags [.], seq 2411:3769, ack 2461, win 4885, options [nop,nop,TS val 6469183 ecr 2326715646], length 1358
13:25:30.695407 68:a3:c4:4e:2c:bd > 8c:be:be:38:d8:fd, ethertype IPv4 (0x0800), length 1424: 192.168.43.197.41204 > 31.13.78.35.443: Flags [.], seq 3769:5127, ack 2461, win 4885, options [nop,nop,TS val 6469183 ecr 2326715646], length 1358
13:25:30.695798 68:a3:c4:4e:2c:bd > 8c:be:be:38:d8:fd, ethertype IPv4 (0x0800), length 1083: 192.168.43.197.41204 > 31.13.78.35.443: Flags [P.], seq 5127:6144, ack 2461, win 4885, options [nop,nop,TS val 6469183 ecr 2326715646], length 1017
13:25:30.696425 8c:be:be:38:d8:fd > 68:a3:c4:4e:2c:bd, ethertype IPv4 (0x0800), length 133: 192.168.43.1.53 > 192.168.43.197.53427: 40769 2/0/0 CNAME star-mini.c10r.facebook.com., A 31.13.78.35 (91)
13:25:30.719453 8c:be:be:38:d8:fd > 68:a3:c4:4e:2c:bd, ethertype IPv4 (0x0800), length 106: 192.168.43.1.53 > 192.168.43.197.58602: 62667 1/0/0 A 157.240.189.17 (64)
13:25:30.719610 68:a3:c4:4e:2c:bd > 8c:be:be:38:d8:fd, ethertype IPv4 (0x0800), length 90: 192.168.43.197.19184 > 192.168.43.1.53: 48054+ AAAA? scontent.fdel1-1.fna.fbcdn.net. (48)
13:25:30.731442 8c:be:be:38:d8:fd > 68:a3:c4:4e:2c:bd, ethertype IPv4 (0x0800), length 133: 192.168.43.1.53 > 192.168.43.197.52291: 31733 2/0/0 CNAME star-mini.c10r.facebook.com., AAAA 2a03:2880:f126:83:face:b00c:0:25de (91)
13:25:30.780057 8c:be:be:38:d8:fd > 68:a3:c4:4e:2c:bd, ethertype IPv4 (0x0800), length 118: 192.168.43.1.53 > 192.168.43.197.19184: 48054 1/0/0 AAAA 2a03:2880:d003:0:face:b00c:0:a7 (76)
13:25:30.790239 8c:be:be:38:d8:fd > 68:a3:c4:4e:2c:bd, ethertype IPv4 (0x0800), length 66: 31.13.78.35.443 > 192.168.43.197.41204: Flags [.], ack 2063, win 2041, options [nop,nop,TS val 2326716514 ecr 6469178], length 0
13:25:30.790265 8c:be:be:38:d8:fd > 68:a3:c4:4e:2c:bd, ethertype IPv4 (0x0800), length 108: 31.13.78.35.443 > 192.168.43.197.41204: Flags [P.], seq 2461:2503, ack 2063, win 2043, options [nop,nop,TS val 2326716514 ecr 6469178], length 42
13:25:30.790282 68:a3:c4:4e:2c:bd > 8c:be:be:38:d8:fd, ethertype IPv4 (0x0800), length 66: 192.168.43.197.41204 > 31.13.78.35.443: Flags [.], ack 2503, win 4885, options [nop,nop,TS val 6469207 ecr 2326716514], length 0
13:25:30.799838 8c:be:be:38:d8:fd > 68:a3:c4:4e:2c:bd, ethertype IPv4 (0x0800), length 108: 31.13.78.35.443 > 192.168.43.197.41204: Flags [P.], seq 2503:2545, ack 2411, win 2043, options [nop,nop,TS val 2326716523 ecr 6469183], length 42
13:25:30.799891 68:a3:c4:4e:2c:bd > 8c:be:be:38:d8:fd, ethertype IPv4 (0x0800), length 66: 192.168.43.197.41204 > 31.13.78.35.443: Flags [.], ack 2545, win 4885, options [nop,nop,TS val 6469209 ecr 2326716523], length 0
13:25:30.830454 8c:be:be:38:d8:fd > 68:a3:c4:4e:2c:bd, ethertype IPv4 (0x0800), length 66: 31.13.78.35.443 > 192.168.43.197.41204: Flags [.], ack 5127, win 2043, options [nop,nop,TS val 2326716546 ecr 6469183], length 0
13:25:30.873464 8c:be:be:38:d8:fd > 68:a3:c4:4e:2c:bd, ethertype IPv4 (0x0800), length 66: 31.13.78.35.443 > 192.168.43.197.41204: Flags [.], ack 6144, win 2043, options [nop,nop,TS val 2326716593 ecr 6469183], length 0
13:25:30.985830 8c:be:be:38:d8:fd > 68:a3:c4:4e:2c:bd, ethertype IPv4 (0x0800), length 1202: 31.13.78.35.443 > 192.168.43.197.41204: Flags [P.], seq 2545:3681, ack 6144, win 2043, options [nop,nop,TS val 2326716705 ecr 6469209], length 1136
13:25:30.985863 68:a3:c4:4e:2c:bd > 8c:be:be:38:d8:fd, ethertype IPv4 (0x0800), length 66: 192.168.43.197.41204 > 31.13.78.35.443: Flags [.], ack 3681, win 4885, options [nop,nop,TS val 6469255 ecr 2326716705], length 0
13:25:30.985894 8c:be:be:38:d8:fd > 68:a3:c4:4e:2c:bd, ethertype IPv4 (0x0800), length 1424: 31.13.78.35.443 > 192.168.43.197.41204: Flags [.], seq 3681:5039, ack 6144, win 2043, options [nop,nop,TS val 2326716705 ecr 6469209], length 1358
13:25:30.985902 68:a3:c4:4e:2c:bd > 8c:be:be:38:d8:fd, ethertype IPv4 (0x0800), length 66: 192.168.43.197.41204 > 31.13.78.35.443: Flags [.], ack 5039, win 4885, options [nop,nop,TS val 6469255 ecr 2326716705], length 0
13:25:30.987737 8c:be:be:38:d8:fd > 68:a3:c4:4e:2c:bd, ethertype IPv4 (0x0800), length 237: 31.13.78.35.443 > 192.168.43.197.41204: Flags [.], seq 5039:5210, ack 6144, win 2043, options [nop,nop,TS val 2326716705 ecr 6469209], length 171
13:25:30.987753 68:a3:c4:4e:2c:bd > 8c:be:be:38:d8:fd, ethertype IPv4 (0x0800), length 66: 192.168.43.197.41204 > 31.13.78.35.443: Flags [.], ack 5210, win 4885, options [nop,nop,TS val 6469256 ecr 2326716705], length 0
13:25:30.989929 8c:be:be:38:d8:fd > 68:a3:c4:4e:2c:bd, ethertype IPv4 (0x0800), length 993: 31.13.78.35.443 > 192.168.43.197.41204: Flags [P.], seq 5210:6137, ack 6144, win 2043, options [nop,nop,TS val 2326716705 ecr 6469209], length 927
13:25:30.989956 68:a3:c4:4e:2c:bd > 8c:be:be:38:d8:fd, ethertype IPv4 (0x0800), length 66: 192.168.43.197.41204 > 31.13.78.35.443: Flags [.], ack 6137, win 4885, options [nop,nop,TS val 6469257 ecr 2326716705], length 0
13:25:30.992315 8c:be:be:38:d8:fd > 68:a3:c4:4e:2c:bd, ethertype IPv4 (0x0800), length 1424: 31.13.78.35.443 > 192.168.43.197.41204: Flags [.], seq 6137:7495, ack 6144, win 2043, options [nop,nop,TS val 2326716705 ecr 6469209], length 1358
13:25:30.992332 68:a3:c4:4e:2c:bd > 8c:be:be:38:d8:fd, ethertype IPv4 (0x0800), length 66: 192.168.43.197.41204 > 31.13.78.35.443: Flags [.], ack 7495, win 4885, options [nop,nop,TS val 6469257 ecr 2326716705], length 0
13:25:30.997933 8c:be:be:38:d8:fd > 68:a3:c4:4e:2c:bd, ethertype IPv4 (0x0800), length 1424: 31.13.78.35.443 > 192.168.43.197.41204: Flags [.], seq 7495:8853, ack 6144, win 2043, options [nop,nop,TS val 2326716705 ecr 6469209], length 1358
13:25:30.997969 68:a3:c4:4e:2c:bd > 8c:be:be:38:d8:fd, ethertype IPv4 (0x0800), length 66: 192.168.43.197.41204 > 31.13.78.35.443: Flags [.], ack 8853, win 4885, options [nop,nop,TS val 6469259 ecr 2326716705], length 0
13:25:30.997994 8c:be:be:38:d8:fd > 68:a3:c4:4e:2c:bd, ethertype IPv4 (0x0800), length 109: 31.13.78.35.443 > 192.168.43.197.41204: Flags [P.], seq 8853:8896, ack 6144, win 2043, options [nop,nop,TS val 2326716705 ecr 6469209], length 43
13:25:30.998000 68:a3:c4:4e:2c:bd > 8c:be:be:38:d8:fd, ethertype IPv4 (0x0800), length 66: 192.168.43.197.41204 > 31.13.78.35.443: Flags [.], ack 8896, win 4885, options [nop,nop,TS val 6469259 ecr 2326716705], length 0
13:25:30.999723 8c:be:be:38:d8:fd > 68:a3:c4:4e:2c:bd, ethertype IPv4 (0x0800), length 532: 31.13.78.35.443 > 192.168.43.197.41204: Flags [P.], seq 8896:9362, ack 6144, win 2043, options [nop,nop,TS val 2326716709 ecr 6469209], length 466
13:25:30.999736 68:a3:c4:4e:2c:bd > 8c:be:be:38:d8:fd, ethertype IPv4 (0x0800), length 66: 192.168.43.197.41204 > 31.13.78.35.443: Flags [.], ack 9362, win 4885, options [nop,nop,TS val 6469259 ecr 2326716709], length 0
13:25:31.003336 8c:be:be:38:d8:fd > 68:a3:c4:4e:2c:bd, ethertype IPv4 (0x0800), length 358: 31.13.78.35.443 > 192.168.43.197.41204: Flags [P.], seq 9362:9654, ack 6144, win 2043, options [nop,nop,TS val 2326716719 ecr 6469209], length 292
13:25:31.003350 68:a3:c4:4e:2c:bd > 8c:be:be:38:d8:fd, ethertype IPv4 (0x0800), length 66: 192.168.43.197.41204 > 31.13.78.35.443: Flags [.], ack 9654, win 4885, options [nop,nop,TS val 6469260 ecr 2326716719], length 0
13:25:31.003367 8c:be:be:38:d8:fd > 68:a3:c4:4e:2c:bd, ethertype IPv4 (0x0800), length 105: 31.13.78.35.443 > 192.168.43.197.41204: Flags [P.], seq 9654:9693, ack 6144, win 2043, options [nop,nop,TS val 2326716719 ecr 6469209], length 39
13:25:31.003372 68:a3:c4:4e:2c:bd > 8c:be:be:38:d8:fd, ethertype IPv4 (0x0800), length 66: 192.168.43.197.41204 > 31.13.78.35.443: Flags [.], ack 9693, win 4885, options [nop,nop,TS val 6469260 ecr 2326716719], length 0
13:25:31.111885 8c:be:be:38:d8:fd > 68:a3:c4:4e:2c:bd, ethertype IPv4 (0x0800), length 1424: 31.13.78.35.443 > 192.168.43.197.41204: Flags [.], seq 9693:11051, ack 6144, win 2043, options [nop,nop,TS val 2326716831 ecr 6469255], length 1358
13:25:31.111910 68:a3:c4:4e:2c:bd > 8c:be:be:38:d8:fd, ethertype IPv4 (0x0800), length 66: 192.168.43.197.41204 > 31.13.78.35.443: Flags [.], ack 11051, win 4885, options [nop,nop,TS val 6469287 ecr 2326716831], length 0
13:25:31.114032 8c:be:be:38:d8:fd > 68:a3:c4:4e:2c:bd, ethertype IPv4 (0x0800), length 1424: 31.13.78.35.443 > 192.168.43.197.41204: Flags [.], seq 11051:12409, ack 6144, win 2043, options [nop,nop,TS val 2326716831 ecr 6469255], length 1358
13:25:31.114050 68:a3:c4:4e:2c:bd > 8c:be:be:38:d8:fd, ethertype IPv4 (0x0800), length 66: 192.168.43.197.41204 > 31.13.78.35.443: Flags [.], ack 12409, win 4885, options [nop,nop,TS val 6469288 ecr 2326716831], length 0
13:25:31.118311 8c:be:be:38:d8:fd > 68:a3:c4:4e:2c:bd, ethertype IPv4 (0x0800), length 1424: 31.13.78.35.443 > 192.168.43.197.41204: Flags [.], seq 12409:13767, ack 6144, win 2043, options [nop,nop,TS val 2326716831 ecr 6469255], length 1358
13:25:31.118336 68:a3:c4:4e:2c:bd > 8c:be:be:38:d8:fd, ethertype IPv4 (0x0800), length 66: 192.168.43.197.41204 > 31.13.78.35.443: Flags [.], ack 13767, win 4885, options [nop,nop,TS val 6469289 ecr 2326716831], length 0
13:25:31.125702 8c:be:be:38:d8:fd > 68:a3:c4:4e:2c:bd, ethertype IPv4 (0x0800), length 1424: 31.13.78.35.443 > 192.168.43.197.41204: Flags [.], seq 13767:15125, ack 6144, win 2043, options [nop,nop,TS val 2326716831 ecr 6469255], length 1358
13:25:31.125724 68:a3:c4:4e:2c:bd > 8c:be:be:38:d8:fd, ethertype IPv4 (0x0800), length 66: 192.168.43.197.41204 > 31.13.78.35.443: Flags [.], ack 15125, win 4885, options [nop,nop,TS val 6469290 ecr 2326716831], length 0
13:25:31.147131 8c:be:be:38:d8:fd > 68:a3:c4:4e:2c:bd, ethertype IPv4 (0x0800), length 1424: 31.13.78.35.443 > 192.168.43.197.41204: Flags [.], seq 15125:16483, ack 6144, win 2043, options [nop,nop,TS val 2326716831 ecr 6469256], length 1358
13:25:31.159959 8c:be:be:38:d8:fd > 68:a3:c4:4e:2c:bd, ethertype IPv4 (0x0800), length 1424: 31.13.78.35.443 > 192.168.43.197.41204: Flags [.], seq 16483:17841, ack 6144, win 2043, options [nop,nop,TS val 2326716831 ecr 6469256], length 1358
13:25:31.159981 68:a3:c4:4e:2c:bd > 8c:be:be:38:d8:fd, ethertype IPv4 (0x0800), length 66: 192.168.43.197.41204 > 31.13.78.35.443: Flags [.], ack 17841, win 4885, options [nop,nop,TS val 6469299 ecr 2326716831], length 0
13:25:31.170553 8c:be:be:38:d8:fd > 68:a3:c4:4e:2c:bd, ethertype IPv4 (0x0800), length 570: 31.13.78.35.443 > 192.168.43.197.41204: Flags [P.], seq 17841:18345, ack 6144, win 2043, options [nop,nop,TS val 2326716831 ecr 6469257], length 504
13:25:31.170660 68:a3:c4:4e:2c:bd > 8c:be:be:38:d8:fd, ethertype IPv4 (0x0800), length 66: 192.168.43.197.41204 > 31.13.78.35.443: Flags [.], ack 18345, win 4885, options [nop,nop,TS val 6469302 ecr 2326716831], length 0
13:25:31.184823 8c:be:be:38:d8:fd > 68:a3:c4:4e:2c:bd, ethertype IPv4 (0x0800), length 1424: 31.13.78.35.443 > 192.168.43.197.41204: Flags [.], seq 18345:19703, ack 6144, win 2043, options [nop,nop,TS val 2326716879 ecr 6469260], length 1358
13:25:31.201893 8c:be:be:38:d8:fd > 68:a3:c4:4e:2c:bd, ethertype IPv4 (0x0800), length 1424: 31.13.78.35.443 > 192.168.43.197.41204: Flags [.], seq 19703:21061, ack 6144, win 2043, options [nop,nop,TS val 2326716879 ecr 6469260], length 1358
13:25:31.201915 68:a3:c4:4e:2c:bd > 8c:be:be:38:d8:fd, ethertype IPv4 (0x0800), length 66: 192.168.43.197.41204 > 31.13.78.35.443: Flags [.], ack 21061, win 4885, options [nop,nop,TS val 6469309 ecr 2326716879], length 0
13:25:31.219541 8c:be:be:38:d8:fd > 68:a3:c4:4e:2c:bd, ethertype IPv4 (0x0800), length 1424: 31.13.78.35.443 > 192.168.43.197.41204: Flags [.], seq 21061:22419, ack 6144, win 2043, options [nop,nop,TS val 2326716879 ecr 6469260], length 1358
13:25:31.219563 8c:be:be:38:d8:fd > 68:a3:c4:4e:2c:bd, ethertype IPv4 (0x0800), length 93: 31.13.78.35.443 > 192.168.43.197.41204: Flags [.], seq 22419:22446, ack 6144, win 2043, options [nop,nop,TS val 2326716879 ecr 6469260], length 27
13:25:31.219572 68:a3:c4:4e:2c:bd > 8c:be:be:38:d8:fd, ethertype IPv4 (0x0800), length 66: 192.168.43.197.41204 > 31.13.78.35.443: Flags [.], ack 22446, win 4885, options [nop,nop,TS val 6469314 ecr 2326716879], length 0
13:25:31.230910 8c:be:be:38:d8:fd > 68:a3:c4:4e:2c:bd, ethertype IPv4 (0x0800), length 1424: 31.13.78.35.443 > 192.168.43.197.41204: Flags [.], seq 22446:23804, ack 6144, win 2043, options [nop,nop,TS val 2326716879 ecr 6469260], length 1358
13:25:31.245864 8c:be:be:38:d8:fd > 68:a3:c4:4e:2c:bd, ethertype IPv4 (0x0800), length 1424: 31.13.78.35.443 > 192.168.43.197.41204: Flags [.], seq 23804:25162, ack 6144, win 2043, options [nop,nop,TS val 2326716879 ecr 6469260], length 1358
13:25:31.245884 68:a3:c4:4e:2c:bd > 8c:be:be:38:d8:fd, ethertype IPv4 (0x0800), length 66: 192.168.43.197.41204 > 31.13.78.35.443: Flags [.], ack 25162, win 4885, options [nop,nop,TS val 6469320 ecr 2326716879], length 0
13:25:31.261483 8c:be:be:38:d8:fd > 68:a3:c4:4e:2c:bd, ethertype IPv4 (0x0800), length 1424: 31.13.78.35.443 > 192.168.43.197.41204: Flags [.], seq 25162:26520, ack 6144, win 2043, options [nop,nop,TS val 2326716879 ecr 6469260], length 1358
13:25:31.261506 8c:be:be:38:d8:fd > 68:a3:c4:4e:2c:bd, ethertype IPv4 (0x0800), length 93: 31.13.78.35.443 > 192.168.43.197.41204: Flags [P.], seq 26520:26547, ack 6144, win 2043, options [nop,nop,TS val 2326716879 ecr 6469260], length 27
13:25:31.261525 68:a3:c4:4e:2c:bd > 8c:be:be:38:d8:fd, ethertype IPv4 (0x0800), length 66: 192.168.43.197.41204 > 31.13.78.35.443: Flags [.], ack 26547, win 4885, options [nop,nop,TS val 6469324 ecr 2326716879], length 0
13:25:31.275866 8c:be:be:38:d8:fd > 68:a3:c4:4e:2c:bd, ethertype IPv4 (0x0800), length 1424: 31.13.78.35.443 > 192.168.43.197.41204: Flags [.], seq 26547:27905, ack 6144, win 2043, options [nop,nop,TS val 2326716879 ecr 6469260], length 1358
13:25:31.291651 8c:be:be:38:d8:fd > 68:a3:c4:4e:2c:bd, ethertype IPv4 (0x0800), length 1424: 31.13.78.35.443 > 192.168.43.197.41204: Flags [.], seq 27905:29263, ack 6144, win 2043, options [nop,nop,TS val 2326716879 ecr 6469260], length 1358
13:25:31.291671 68:a3:c4:4e:2c:bd > 8c:be:be:38:d8:fd, ethertype IPv4 (0x0800), length 66: 192.168.43.197.41204 > 31.13.78.35.443: Flags [.], ack 29263, win 4885, options [nop,nop,TS val 6469332 ecr 2326716879], length 0
13:25:31.302370 8c:be:be:38:d8:fd > 68:a3:c4:4e:2c:bd, ethertype IPv4 (0x0800), length 1424: 31.13.78.35.443 > 192.168.43.197.41204: Flags [.], seq 29263:30621, ack 6144, win 2043, options [nop,nop,TS val 2326716879 ecr 6469260], length 1358
13:25:31.306492 8c:be:be:38:d8:fd > 68:a3:c4:4e:2c:bd, ethertype IPv4 (0x0800), length 131: 31.13.78.35.443 > 192.168.43.197.41204: Flags [.], seq 30621:30686, ack 6144, win 2043, options [nop,nop,TS val 2326716879 ecr 6469260], length 65
13:25:31.306511 68:a3:c4:4e:2c:bd > 8c:be:be:38:d8:fd, ethertype IPv4 (0x0800), length 66: 192.168.43.197.41204 > 31.13.78.35.443: Flags [.], ack 30686, win 4885, options [nop,nop,TS val 6469336 ecr 2326716879], length 0
13:25:31.320896 8c:be:be:38:d8:fd > 68:a3:c4:4e:2c:bd, ethertype IPv4 (0x0800), length 1424: 31.13.78.35.443 > 192.168.43.197.41204: Flags [.], seq 30686:32044, ack 6144, win 2043, options [nop,nop,TS val 2326716879 ecr 6469260], length 1358
13:25:31.335707 8c:be:be:38:d8:fd > 68:a3:c4:4e:2c:bd, ethertype IPv4 (0x0800), length 1424: 31.13.78.35.443 > 192.168.43.197.41204: Flags [.], seq 32044:33402, ack 6144, win 2043, options [nop,nop,TS val 2326716942 ecr 6469287], length 1358
13:25:31.335728 68:a3:c4:4e:2c:bd > 8c:be:be:38:d8:fd, ethertype IPv4 (0x0800), length 66: 192.168.43.197.41204 > 31.13.78.35.443: Flags [.], ack 33402, win 4885, options [nop,nop,TS val 6469343 ecr 2326716879], length 0
