08:35:53.288538 8c:be:be:38:d8:fd > 68:a3:c4:4e:2c:bd, ethertype IPv4 (0x0800), length 78: 52.36.207.192.443 > 192.168.43.197.54812: Flags [.], ack 2448363781, win 110, options [nop,nop,TS val 902839674 ecr 4294911785,nop,nop,sack 1 {32:33}], length 0
08:35:53.288560 8c:be:be:38:d8:fd > 68:a3:c4:4e:2c:bd, ethertype IPv4 (0x0800), length 66: 52.36.207.192.443 > 192.168.43.197.54812: Flags [.], ack 33, win 110, options [nop,nop,TS val 902839677 ecr 4294913007], length 0
08:35:53.288574 8c:be:be:38:d8:fd > 68:a3:c4:4e:2c:bd, ethertype IPv4 (0x0800), length 97: 52.36.207.192.443 > 192.168.43.197.54812: Flags [P.], seq 0:31, ack 33, win 110, options [nop,nop,TS val 902839677 ecr 4294913007], length 31
08:35:53.288589 68:a3:c4:4e:2c:bd > 8c:be:be:38:d8:fd, ethertype IPv4 (0x0800), length 54: 192.168.43.197.54812 > 52.36.207.192.443: Flags [R], seq 2448363813, win 0, length 0
08:35:53.288609 8c:be:be:38:d8:fd > 68:a3:c4:4e:2c:bd, ethertype IPv4 (0x0800), length 66: 52.36.207.192.443 > 192.168.43.197.54812: Flags [F.], seq 31, ack 33, win 110, options [nop,nop,TS val 902839677 ecr 4294913007], length 0
08:35:53.288614 68:a3:c4:4e:2c:bd > 8c:be:be:38:d8:fd, ethertype IPv4 (0x0800), length 54: 192.168.43.197.54812 > 52.36.207.192.443: Flags [R], seq 2448363813, win 0, length 0
08:35:53.780398 68:a3:c4:4e:2c:bd > 8c:be:be:38:d8:fd, ethertype IPv4 (0x0800), length 66: 192.168.43.197.54764 > 128.30.52.100.80: Flags [F.], seq 391714778, ack 3306694812, win 229, options [nop,nop,TS val 4294913258 ecr 39266263], length 0
08:35:53.780442 68:a3:c4:4e:2c:bd > 8c:be:be:38:d8:fd, ethertype IPv4 (0x0800), length 66: 192.168.43.197.54766 > 128.30.52.100.80: Flags [F.], seq 4273063519, ack 912639633, win 229, options [nop,nop,TS val 4294913258 ecr 39266327], length 0
08:35:53.877388 68:a3:c4:4e:2c:bd > 33:33:00:00:00:fb, ethertype IPv6 (0x86dd), length 107: 2405:204:a18c:2644:6aa3:c4ff:fe4e:2cbd.5353 > ff02::fb.5353: 0 [2q] PTR (QM)? _ipp._tcp.local. PTR (QM)? _ipps._tcp.local. (45)
08:35:53.877498 68:a3:c4:4e:2c:bd > 01:00:5e:00:00:fb, ethertype IPv4 (0x0800), length 87: 192.168.43.197.5353 > 224.0.0.251.5353: 0 [2q] PTR (QM)? _ipp._tcp.local. PTR (QM)? _ipps._tcp.local. (45)
08:35:54.248580 8c:be:be:38:d8:fd > 68:a3:c4:4e:2c:bd, ethertype IPv4 (0x0800), length 253: 128.30.52.100.80 > 192.168.43.197.54766: Flags [F.], seq 1:188, ack 1, win 204, options [nop,nop,TS val 39267835 ecr 4294913258], length 187
08:35:54.248643 68:a3:c4:4e:2c:bd > 8c:be:be:38:d8:fd, ethertype IPv4 (0x0800), length 54: 192.168.43.197.54766 > 128.30.52.100.80: Flags [R], seq 4273063520, win 0, length 0
08:35:54.248662 8c:be:be:38:d8:fd > 68:a3:c4:4e:2c:bd, ethertype IPv4 (0x0800), length 66: 128.30.52.100.80 > 192.168.43.197.54764: Flags [.], ack 1, win 204, options [nop,nop,TS val 39267833 ecr 4294913258], length 0
08:35:54.248672 8c:be:be:38:d8:fd > 68:a3:c4:4e:2c:bd, ethertype IPv4 (0x0800), length 253: 128.30.52.100.80 > 192.168.43.197.54764: Flags [F.], seq 1:188, ack 1, win 204, options [nop,nop,TS val 39267833 ecr 4294913258], length 187
08:35:54.248678 68:a3:c4:4e:2c:bd > 8c:be:be:38:d8:fd, ethertype IPv4 (0x0800), length 54: 192.168.43.197.54764 > 128.30.52.100.80: Flags [R], seq 391714779, win 0, length 0
08:35:54.780571 68:a3:c4:4e:2c:bd > 8c:be:be:38:d8:fd, ethertype IPv4 (0x0800), length 66: 192.168.43.197.39268 > 117.18.237.29.80: Flags [F.], seq 2073852718, ack 2898442957, win 229, options [nop,nop,TS val 4294913508 ecr 1816276959], length 0
08:35:54.780620 68:a3:c4:4e:2c:bd > 8c:be:be:38:d8:fd, ethertype IPv4 (0x0800), length 66: 192.168.43.197.39270 > 117.18.237.29.80: Flags [F.], seq 3686301560, ack 943539625, win 229, options [nop,nop,TS val 4294913508 ecr 1769772187], length 0
08:35:54.780652 68:a3:c4:4e:2c:bd > 8c:be:be:38:d8:fd, ethertype IPv4 (0x0800), length 66: 192.168.43.197.39266 > 117.18.237.29.80: Flags [F.], seq 478398765, ack 2612754067, win 229, options [nop,nop,TS val 4294913508 ecr 1769772188], length 0
08:35:54.908023 8c:be:be:38:d8:fd > 68:a3:c4:4e:2c:bd, ethertype IPv4 (0x0800), length 66: 117.18.237.29.80 > 192.168.43.197.39268: Flags [F.], seq 1, ack 1, win 283, options [nop,nop,TS val 1816278299 ecr 4294913508], length 0
08:35:54.908061 68:a3:c4:4e:2c:bd > 8c:be:be:38:d8:fd, ethertype IPv4 (0x0800), length 66: 192.168.43.197.39268 > 117.18.237.29.80: Flags [.], ack 2, win 229, options [nop,nop,TS val 4294913540 ecr 1816278299], length 0
08:35:54.919491 8c:be:be:38:d8:fd > 68:a3:c4:4e:2c:bd, ethertype IPv4 (0x0800), length 66: 117.18.237.29.80 > 192.168.43.197.39270: Flags [F.], seq 1, ack 1, win 283, options [nop,nop,TS val 1769773529 ecr 4294913508], length 0
08:35:54.919517 68:a3:c4:4e:2c:bd > 8c:be:be:38:d8:fd, ethertype IPv4 (0x0800), length 66: 192.168.43.197.39270 > 117.18.237.29.80: Flags [.], ack 2, win 229, options [nop,nop,TS val 4294913542 ecr 1769773529], length 0
08:35:54.919539 8c:be:be:38:d8:fd > 68:a3:c4:4e:2c:bd, ethertype IPv4 (0x0800), length 66: 117.18.237.29.80 > 192.168.43.197.39266: Flags [F.], seq 1, ack 1, win 283, options [nop,nop,TS val 1769773530 ecr 4294913508], length 0
08:35:54.919544 68:a3:c4:4e:2c:bd > 8c:be:be:38:d8:fd, ethertype IPv4 (0x0800), length 66: 192.168.43.197.39266 > 117.18.237.29.80: Flags [.], ack 2, win 229, options [nop,nop,TS val 4294913542 ecr 1769773530], length 0
08:35:55.734193 68:a3:c4:4e:2c:bd > 8c:be:be:38:d8:fd, ethertype IPv6 (0x86dd), length 94: 2405:204:a18c:2644:181d:419a:85f7:92eb.37766 > 2404:6800:4003:c02::63.443: Flags [S], seq 2842471661, win 28800, options [mss 1440,sackOK,TS val 4294913746 ecr 0,nop,wscale 7], length 0
08:35:55.745462 68:a3:c4:4e:2c:bd > 8c:be:be:38:d8:fd, ethertype IPv4 (0x0800), length 62: 192.168.43.197.49939 > 192.168.43.1.53: 18956+ A? fb. (20)
08:35:55.745495 68:a3:c4:4e:2c:bd > 8c:be:be:38:d8:fd, ethertype IPv4 (0x0800), length 62: 192.168.43.197.62822 > 192.168.43.1.53: 10891+ AAAA? fb. (20)
08:35:55.750282 8c:be:be:38:d8:fd > 68:a3:c4:4e:2c:bd, ethertype IPv4 (0x0800), length 62: 192.168.43.1.53 > 192.168.43.197.49939: 18956 NXDomain 0/0/0 (20)
08:35:55.780914 68:a3:c4:4e:2c:bd > 8c:be:be:38:d8:fd, ethertype IPv4 (0x0800), length 97: 192.168.43.197.38372 > 52.222.135.252.443: Flags [P.], seq 369248036:369248067, ack 1364990902, win 316, options [nop,nop,TS val 4294913758 ecr 2618629580], length 31
08:35:55.780941 68:a3:c4:4e:2c:bd > 8c:be:be:38:d8:fd, ethertype IPv4 (0x0800), length 66: 192.168.43.197.38372 > 52.222.135.252.443: Flags [F.], seq 31, ack 1, win 316, options [nop,nop,TS val 4294913758 ecr 2618629580], length 0
08:35:55.807547 8c:be:be:38:d8:fd > 68:a3:c4:4e:2c:bd, ethertype IPv6 (0x86dd), length 86: fe80::880:68ff:fe28:9ec5 > fe80::6aa3:c4ff:fe4e:2cbd: ICMP6, neighbor solicitation, who has fe80::6aa3:c4ff:fe4e:2cbd, length 32
08:35:55.807624 68:a3:c4:4e:2c:bd > 8c:be:be:38:d8:fd, ethertype IPv6 (0x86dd), length 78: fe80::6aa3:c4ff:fe4e:2cbd > fe80::880:68ff:fe28:9ec5: ICMP6, neighbor advertisement, tgt is fe80::6aa3:c4ff:fe4e:2cbd, length 24
08:35:55.862239 8c:be:be:38:d8:fd > 68:a3:c4:4e:2c:bd, ethertype IPv4 (0x0800), length 78: 52.222.135.252.443 > 192.168.43.197.38372: Flags [.], ack 0, win 118, options [nop,nop,TS val 2618630126 ecr 4294912422,nop,nop,sack 1 {31:32}], length 0
08:35:55.864475 8c:be:be:38:d8:fd > 68:a3:c4:4e:2c:bd, ethertype IPv4 (0x0800), length 66: 52.222.135.252.443 > 192.168.43.197.38372: Flags [.], ack 32, win 118, options [nop,nop,TS val 2618630127 ecr 4294913758], length 0
08:35:55.864535 8c:be:be:38:d8:fd > 68:a3:c4:4e:2c:bd, ethertype IPv4 (0x0800), length 66: 52.222.135.252.443 > 192.168.43.197.38372: Flags [F.], seq 1, ack 32, win 118, options [nop,nop,TS val 2618630127 ecr 4294913758], length 0
08:35:55.864554 68:a3:c4:4e:2c:bd > 8c:be:be:38:d8:fd, ethertype IPv4 (0x0800), length 66: 192.168.43.197.38372 > 52.222.135.252.443: Flags [.], ack 2, win 316, options [nop,nop,TS val 4294913779 ecr 2618630127], length 0
08:35:55.904895 8c:be:be:38:d8:fd > 68:a3:c4:4e:2c:bd, ethertype IPv6 (0x86dd), length 94: 2404:6800:4003:c02::63.443 > 2405:204:a18c:2644:181d:419a:85f7:92eb.37766: Flags [S.], seq 409101046, ack 2842471662, win 43136, options [mss 1360,sackOK,TS val 2979523021 ecr 4294913746,nop,wscale 8], length 0
08:35:55.904933 68:a3:c4:4e:2c:bd > 8c:be:be:38:d8:fd, ethertype IPv6 (0x86dd), length 86: 2405:204:a18c:2644:181d:419a:85f7:92eb.37766 > 2404:6800:4003:c02::63.443: Flags [.], ack 1, win 225, options [nop,nop,TS val 4294913789 ecr 2979523021], length 0
08:35:55.905182 68:a3:c4:4e:2c:bd > 8c:be:be:38:d8:fd, ethertype IPv6 (0x86dd), length 282: 2405:204:a18c:2644:181d:419a:85f7:92eb.37766 > 2404:6800:4003:c02::63.443: Flags [P.], seq 1:197, ack 1, win 225, options [nop,nop,TS val 4294913789 ecr 2979523021], length 196
08:35:55.920877 8c:be:be:38:d8:fd > 68:a3:c4:4e:2c:bd, ethertype IPv4 (0x0800), length 137: 192.168.43.1.53 > 192.168.43.197.62822: 10891 NXDomain 0/1/0 (95)
08:35:55.921318 68:a3:c4:4e:2c:bd > 8c:be:be:38:d8:fd, ethertype IPv4 (0x0800), length 62: 192.168.43.197.13569 > 192.168.43.1.53: 52995+ A? fb. (20)
08:35:55.921343 68:a3:c4:4e:2c:bd > 8c:be:be:38:d8:fd, ethertype IPv4 (0x0800), length 62: 192.168.43.197.53208 > 192.168.43.1.53: 8708+ AAAA? fb. (20)
08:35:55.924386 8c:be:be:38:d8:fd > 68:a3:c4:4e:2c:bd, ethertype IPv4 (0x0800), length 62: 192.168.43.1.53 > 192.168.43.197.13569: 52995 NXDomain 0/0/0 (20)
08:35:56.036278 8c:be:be:38:d8:fd > 68:a3:c4:4e:2c:bd, ethertype IPv6 (0x86dd), length 86: 2404:6800:4003:c02::63.443 > 2405:204:a18c:2644:181d:419a:85f7:92eb.37766: Flags [.], ack 197, win 173, options [nop,nop,TS val 2979523151 ecr 4294913789], length 0
08:35:56.038642 8c:be:be:38:d8:fd > 68:a3:c4:4e:2c:bd, ethertype IPv6 (0x86dd), length 1294: 2404:6800:4003:c02::63.443 > 2405:204:a18c:2644:181d:419a:85f7:92eb.37766: Flags [.], seq 1:1209, ack 197, win 173, options [nop,nop,TS val 2979523153 ecr 4294913789], length 1208
08:35:56.038684 68:a3:c4:4e:2c:bd > 8c:be:be:38:d8:fd, ethertype IPv6 (0x86dd), length 86: 2405:204:a18c:2644:181d:419a:85f7:92eb.37766 > 2404:6800:4003:c02::63.443: Flags [.], ack 1209, win 244, options [nop,nop,TS val 4294913822 ecr 2979523153], length 0
08:35:56.039991 8c:be:be:38:d8:fd > 68:a3:c4:4e:2c:bd, ethertype IPv6 (0x86dd), length 1294: 2404:6800:4003:c02::63.443 > 2405:204:a18c:2644:181d:419a:85f7:92eb.37766: Flags [.], seq 1209:2417, ack 197, win 173, options [nop,nop,TS val 2979523153 ecr 4294913789], length 1208
08:35:56.040031 68:a3:c4:4e:2c:bd > 8c:be:be:38:d8:fd, ethertype IPv6 (0x86dd), length 86: 2405:204:a18c:2644:181d:419a:85f7:92eb.37766 > 2404:6800:4003:c02::63.443: Flags [.], ack 2417, win 263, options [nop,nop,TS val 4294913823 ecr 2979523153], length 0
08:35:56.042586 8c:be:be:38:d8:fd > 68:a3:c4:4e:2c:bd, ethertype IPv6 (0x86dd), length 1236: 2404:6800:4003:c02::63.443 > 2405:204:a18c:2644:181d:419a:85f7:92eb.37766: Flags [P.], seq 2417:3567, ack 197, win 173, options [nop,nop,TS val 2979523153 ecr 4294913789], length 1150
08:35:56.042616 68:a3:c4:4e:2c:bd > 8c:be:be:38:d8:fd, ethertype IPv6 (0x86dd), length 86: 2405:204:a18c:2644:181d:419a:85f7:92eb.37766 > 2404:6800:4003:c02::63.443: Flags [.], ack 3567, win 282, options [nop,nop,TS val 4294913823 ecr 2979523153], length 0
08:35:56.045421 68:a3:c4:4e:2c:bd > 8c:be:be:38:d8:fd, ethertype IPv4 (0x0800), length 79: 192.168.43.197.65297 > 192.168.43.1.53: 18327+ A? clients1.google.com. (37)
08:35:56.045454 68:a3:c4:4e:2c:bd > 8c:be:be:38:d8:fd, ethertype IPv4 (0x0800), length 79: 192.168.43.197.44364 > 192.168.43.1.53: 1175+ AAAA? clients1.google.com. (37)
08:35:56.046102 68:a3:c4:4e:2c:bd > 8c:be:be:38:d8:fd, ethertype IPv6 (0x86dd), length 212: 2405:204:a18c:2644:181d:419a:85f7:92eb.37766 > 2404:6800:4003:c02::63.443: Flags [P.], seq 197:323, ack 3567, win 282, options [nop,nop,TS val 4294913824 ecr 2979523153], length 126
08:35:56.076681 8c:be:be:38:d8:fd > 68:a3:c4:4e:2c:bd, ethertype IPv4 (0x0800), length 137: 192.168.43.1.53 > 192.168.43.197.53208: 8708 NXDomain 0/1/0 (95)
08:35:56.116803 8c:be:be:38:d8:fd > 68:a3:c4:4e:2c:bd, ethertype IPv4 (0x0800), length 119: 192.168.43.1.53 > 192.168.43.197.65297: 18327 2/0/0 CNAME clients.l.google.com., A 216.58.220.206 (77)
08:35:56.116851 8c:be:be:38:d8:fd > 68:a3:c4:4e:2c:bd, ethertype IPv4 (0x0800), length 131: 192.168.43.1.53 > 192.168.43.197.44364: 1175 2/0/0 CNAME clients.l.google.com., AAAA 2404:6800:4002:804::200e (89)
08:35:56.117191 68:a3:c4:4e:2c:bd > 8c:be:be:38:d8:fd, ethertype IPv6 (0x86dd), length 94: 2405:204:a18c:2644:181d:419a:85f7:92eb.53696 > 2404:6800:4002:804::200e.80: Flags [S], seq 3024244429, win 28800, options [mss 1440,sackOK,TS val 4294913842 ecr 0,nop,wscale 7], length 0
08:35:56.178326 8c:be:be:38:d8:fd > 68:a3:c4:4e:2c:bd, ethertype IPv6 (0x86dd), length 388: 2404:6800:4003:c02::63.443 > 2405:204:a18c:2644:181d:419a:85f7:92eb.37766: Flags [P.], seq 3567:3869, ack 323, win 173, options [nop,nop,TS val 2979523293 ecr 4294913824], length 302
08:35:56.178384 8c:be:be:38:d8:fd > 68:a3:c4:4e:2c:bd, ethertype IPv6 (0x86dd), length 142: 2404:6800:4003:c02::63.443 > 2405:204:a18c:2644:181d:419a:85f7:92eb.37766: Flags [P.], seq 3869:3925, ack 323, win 173, options [nop,nop,TS val 2979523293 ecr 4294913824], length 56
08:35:56.178399 8c:be:be:38:d8:fd > 68:a3:c4:4e:2c:bd, ethertype IPv6 (0x86dd), length 128: 2404:6800:4003:c02::63.443 > 2405:204:a18c:2644:181d:419a:85f7:92eb.37766: Flags [P.], seq 3925:3967, ack 323, win 173, options [nop,nop,TS val 2979523293 ecr 4294913824], length 42
08:35:56.195731 8c:be:be:38:d8:fd > 68:a3:c4:4e:2c:bd, ethertype IPv6 (0x86dd), length 94: 2404:6800:4002:804::200e.80 > 2405:204:a18c:2644:181d:419a:85f7:92eb.53696: Flags [S.], seq 520745463, ack 3024244430, win 26960, options [mss 1360,sackOK,TS val 1648911453 ecr 4294913842,nop,wscale 7], length 0
08:35:56.195810 68:a3:c4:4e:2c:bd > 8c:be:be:38:d8:fd, ethertype IPv6 (0x86dd), length 86: 2405:204:a18c:2644:181d:419a:85f7:92eb.53696 > 2404:6800:4002:804::200e.80: Flags [.], ack 1, win 225, options [nop,nop,TS val 4294913861 ecr 1648911453], length 0
08:35:56.195979 68:a3:c4:4e:2c:bd > 8c:be:be:38:d8:fd, ethertype IPv6 (0x86dd), length 523: 2405:204:a18c:2644:181d:419a:85f7:92eb.53696 > 2404:6800:4002:804::200e.80: Flags [P.], seq 1:438, ack 1, win 225, options [nop,nop,TS val 4294913862 ecr 1648911453], length 437
08:35:56.215905 68:a3:c4:4e:2c:bd > 8c:be:be:38:d8:fd, ethertype IPv6 (0x86dd), length 86: 2405:204:a18c:2644:181d:419a:85f7:92eb.37766 > 2404:6800:4003:c02::63.443: Flags [.], ack 3967, win 301, options [nop,nop,TS val 4294913867 ecr 2979523293], length 0
08:35:56.276724 8c:be:be:38:d8:fd > 68:a3:c4:4e:2c:bd, ethertype IPv6 (0x86dd), length 86: 2404:6800:4002:804::200e.80 > 2405:204:a18c:2644:181d:419a:85f7:92eb.53696: Flags [.], ack 438, win 219, options [nop,nop,TS val 1648911536 ecr 4294913862], length 0
08:35:56.367159 8c:be:be:38:d8:fd > 68:a3:c4:4e:2c:bd, ethertype IPv6 (0x86dd), length 832: 2404:6800:4002:804::200e.80 > 2405:204:a18c:2644:181d:419a:85f7:92eb.53696: Flags [P.], seq 1:747, ack 438, win 219, options [nop,nop,TS val 1648911634 ecr 4294913862], length 746
08:35:56.367212 68:a3:c4:4e:2c:bd > 8c:be:be:38:d8:fd, ethertype IPv6 (0x86dd), length 86: 2405:204:a18c:2644:181d:419a:85f7:92eb.53696 > 2404:6800:4002:804::200e.80: Flags [.], ack 747, win 237, options [nop,nop,TS val 4294913904 ecr 1648911634], length 0
08:35:56.368290 68:a3:c4:4e:2c:bd > 8c:be:be:38:d8:fd, ethertype IPv6 (0x86dd), length 243: 2405:204:a18c:2644:181d:419a:85f7:92eb.37766 > 2404:6800:4003:c02::63.443: Flags [P.], seq 323:480, ack 3967, win 301, options [nop,nop,TS val 4294913905 ecr 2979523293], length 157
08:35:56.368552 68:a3:c4:4e:2c:bd > 8c:be:be:38:d8:fd, ethertype IPv6 (0x86dd), length 745: 2405:204:a18c:2644:181d:419a:85f7:92eb.37766 > 2404:6800:4003:c02::63.443: Flags [P.], seq 480:1139, ack 3967, win 301, options [nop,nop,TS val 4294913905 ecr 2979523293], length 659
08:35:56.517577 8c:be:be:38:d8:fd > 68:a3:c4:4e:2c:bd, ethertype IPv6 (0x86dd), length 124: 2404:6800:4003:c02::63.443 > 2405:204:a18c:2644:181d:419a:85f7:92eb.37766: Flags [P.], seq 3967:4005, ack 480, win 177, options [nop,nop,TS val 2979523622 ecr 4294913905], length 38
08:35:56.517651 68:a3:c4:4e:2c:bd > 8c:be:be:38:d8:fd, ethertype IPv6 (0x86dd), length 86: 2405:204:a18c:2644:181d:419a:85f7:92eb.37766 > 2404:6800:4003:c02::63.443: Flags [.], ack 4005, win 301, options [nop,nop,TS val 4294913942 ecr 2979523622], length 0
08:35:56.517668 8c:be:be:38:d8:fd > 68:a3:c4:4e:2c:bd, ethertype IPv6 (0x86dd), length 345: 2404:6800:4003:c02::63.443 > 2405:204:a18c:2644:181d:419a:85f7:92eb.37766: Flags [P.], seq 4005:4264, ack 1139, win 183, options [nop,nop,TS val 2979523626 ecr 4294913905], length 259
08:35:56.517679 68:a3:c4:4e:2c:bd > 8c:be:be:38:d8:fd, ethertype IPv6 (0x86dd), length 86: 2405:204:a18c:2644:181d:419a:85f7:92eb.37766 > 2404:6800:4003:c02::63.443: Flags [.], ack 4264, win 320, options [nop,nop,TS val 4294913942 ecr 2979523626], length 0
08:35:56.517684 8c:be:be:38:d8:fd > 68:a3:c4:4e:2c:bd, ethertype IPv6 (0x86dd), length 460: 2404:6800:4003:c02::63.443 > 2405:204:a18c:2644:181d:419a:85f7:92eb.37766: Flags [P.], seq 4264:4638, ack 1139, win 183, options [nop,nop,TS val 2979523626 ecr 4294913905], length 374
08:35:56.517687 68:a3:c4:4e:2c:bd > 8c:be:be:38:d8:fd, ethertype IPv6 (0x86dd), length 86: 2405:204:a18c:2644:181d:419a:85f7:92eb.37766 > 2404:6800:4003:c02::63.443: Flags [.], ack 4638, win 339, options [nop,nop,TS val 4294913942 ecr 2979523626], length 0
08:35:56.517695 8c:be:be:38:d8:fd > 68:a3:c4:4e:2c:bd, ethertype IPv6 (0x86dd), length 132: 2404:6800:4003:c02::63.443 > 2405:204:a18c:2644:181d:419a:85f7:92eb.37766: Flags [P.], seq 4638:4684, ack 1139, win 183, options [nop,nop,TS val 2979523626 ecr 4294913905], length 46
08:35:56.517698 68:a3:c4:4e:2c:bd > 8c:be:be:38:d8:fd, ethertype IPv6 (0x86dd), length 86: 2405:204:a18c:2644:181d:419a:85f7:92eb.37766 > 2404:6800:4003:c02::63.443: Flags [.], ack 4684, win 339, options [nop,nop,TS val 4294913942 ecr 2979523626], length 0
08:35:56.517993 68:a3:c4:4e:2c:bd > 8c:be:be:38:d8:fd, ethertype IPv6 (0x86dd), length 132: 2405:204:a18c:2644:181d:419a:85f7:92eb.37766 > 2404:6800:4003:c02::63.443: Flags [P.], seq 1139:1185, ack 4684, win 339, options [nop,nop,TS val 4294913942 ecr 2979523626], length 46
08:35:56.519377 68:a3:c4:4e:2c:bd > 8c:be:be:38:d8:fd, ethertype IPv4 (0x0800), length 76: 192.168.43.197.32249 > 192.168.43.1.53: 26125+ A? www.google.co.in. (34)
08:35:56.597878 8c:be:be:38:d8:fd > 68:a3:c4:4e:2c:bd, ethertype IPv4 (0x0800), length 92: 192.168.43.1.53 > 192.168.43.197.32249: 26125 1/0/0 A 216.58.220.195 (50)
08:35:56.598142 68:a3:c4:4e:2c:bd > 8c:be:be:38:d8:fd, ethertype IPv4 (0x0800), length 76: 192.168.43.197.45911 > 192.168.43.1.53: 54755+ AAAA? www.google.co.in. (34)
08:35:56.645304 8c:be:be:38:d8:fd > 68:a3:c4:4e:2c:bd, ethertype IPv4 (0x0800), length 104: 192.168.43.1.53 > 192.168.43.197.45911: 54755 1/0/0 AAAA 2404:6800:4002:804::2003 (62)
08:35:56.645761 68:a3:c4:4e:2c:bd > 8c:be:be:38:d8:fd, ethertype IPv6 (0x86dd), length 94: 2405:204:a18c:2644:181d:419a:85f7:92eb.38244 > 2404:6800:4002:804::2003.443: Flags [S], seq 3153679997, win 28800, options [mss 1440,sackOK,TS val 4294913974 ecr 0,nop,wscale 7], length 0
08:35:56.697094 8c:be:be:38:d8:fd > 68:a3:c4:4e:2c:bd, ethertype IPv6 (0x86dd), length 86: 2404:6800:4003:c02::63.443 > 2405:204:a18c:2644:181d:419a:85f7:92eb.37766: Flags [.], ack 1185, win 183, options [nop,nop,TS val 2979523812 ecr 4294913942], length 0
08:35:56.737058 8c:be:be:38:d8:fd > 68:a3:c4:4e:2c:bd, ethertype IPv6 (0x86dd), length 94: 2404:6800:4002:804::2003.443 > 2405:204:a18c:2644:181d:419a:85f7:92eb.38244: Flags [S.], seq 2594814665, ack 3153679998, win 26960, options [mss 1360,sackOK,TS val 1572193382 ecr 4294913974,nop,wscale 7], length 0
08:35:56.737133 68:a3:c4:4e:2c:bd > 8c:be:be:38:d8:fd, ethertype IPv6 (0x86dd), length 86: 2405:204:a18c:2644:181d:419a:85f7:92eb.38244 > 2404:6800:4002:804::2003.443: Flags [.], ack 1, win 225, options [nop,nop,TS val 4294913997 ecr 1572193382], length 0
08:35:56.737355 68:a3:c4:4e:2c:bd > 8c:be:be:38:d8:fd, ethertype IPv6 (0x86dd), length 284: 2405:204:a18c:2644:181d:419a:85f7:92eb.38244 > 2404:6800:4002:804::2003.443: Flags [P.], seq 1:199, ack 1, win 225, options [nop,nop,TS val 4294913997 ecr 1572193382], length 198
08:35:56.819122 8c:be:be:38:d8:fd > 68:a3:c4:4e:2c:bd, ethertype IPv6 (0x86dd), length 86: 2404:6800:4002:804::2003.443 > 2405:204:a18c:2644:181d:419a:85f7:92eb.38244: Flags [.], ack 199, win 219, options [nop,nop,TS val 1572193463 ecr 4294913997], length 0
08:35:56.821603 8c:be:be:38:d8:fd > 68:a3:c4:4e:2c:bd, ethertype IPv6 (0x86dd), length 1294: 2404:6800:4002:804::2003.443 > 2405:204:a18c:2644:181d:419a:85f7:92eb.38244: Flags [.], seq 1:1209, ack 199, win 219, options [nop,nop,TS val 1572193464 ecr 4294913997], length 1208
08:35:56.821628 68:a3:c4:4e:2c:bd > 8c:be:be:38:d8:fd, ethertype IPv6 (0x86dd), length 86: 2405:204:a18c:2644:181d:419a:85f7:92eb.38244 > 2404:6800:4002:804::2003.443: Flags [.], ack 1209, win 244, options [nop,nop,TS val 4294914018 ecr 1572193464], length 0
08:35:56.825453 8c:be:be:38:d8:fd > 68:a3:c4:4e:2c:bd, ethertype IPv6 (0x86dd), length 1294: 2404:6800:4002:804::2003.443 > 2405:204:a18c:2644:181d:419a:85f7:92eb.38244: Flags [.], seq 1209:2417, ack 199, win 219, options [nop,nop,TS val 1572193464 ecr 4294913997], length 1208
08:35:56.825505 68:a3:c4:4e:2c:bd > 8c:be:be:38:d8:fd, ethertype IPv6 (0x86dd), length 86: 2405:204:a18c:2644:181d:419a:85f7:92eb.38244 > 2404:6800:4002:804::2003.443: Flags [.], ack 2417, win 263, options [nop,nop,TS val 4294914019 ecr 1572193464], length 0
08:35:56.837076 8c:be:be:38:d8:fd > 68:a3:c4:4e:2c:bd, ethertype IPv6 (0x86dd), length 1294: 2404:6800:4002:804::2003.443 > 2405:204:a18c:2644:181d:419a:85f7:92eb.38244: Flags [.], seq 2417:3625, ack 199, win 219, options [nop,nop,TS val 1572193464 ecr 4294913997], length 1208
08:35:56.837126 68:a3:c4:4e:2c:bd > 8c:be:be:38:d8:fd, ethertype IPv6 (0x86dd), length 86: 2405:204:a18c:2644:181d:419a:85f7:92eb.38244 > 2404:6800:4002:804::2003.443: Flags [.], ack 3625, win 282, options [nop,nop,TS val 4294914022 ecr 1572193464], length 0
08:35:56.837149 8c:be:be:38:d8:fd > 68:a3:c4:4e:2c:bd, ethertype IPv6 (0x86dd), length 621: 2404:6800:4002:804::2003.443 > 2405:204:a18c:2644:181d:419a:85f7:92eb.38244: Flags [P.], seq 3625:4160, ack 199, win 219, options [nop,nop,TS val 1572193464 ecr 4294913997], length 535
08:35:56.837166 68:a3:c4:4e:2c:bd > 8c:be:be:38:d8:fd, ethertype IPv6 (0x86dd), length 86: 2405:204:a18c:2644:181d:419a:85f7:92eb.38244 > 2404:6800:4002:804::2003.443: Flags [.], ack 4160, win 301, options [nop,nop,TS val 4294914022 ecr 1572193464], length 0
08:35:56.841903 68:a3:c4:4e:2c:bd > 8c:be:be:38:d8:fd, ethertype IPv6 (0x86dd), length 212: 2405:204:a18c:2644:181d:419a:85f7:92eb.38244 > 2404:6800:4002:804::2003.443: Flags [P.], seq 199:325, ack 4160, win 301, options [nop,nop,TS val 4294914023 ecr 1572193464], length 126
08:35:56.841979 68:a3:c4:4e:2c:bd > 8c:be:be:38:d8:fd, ethertype IPv6 (0x86dd), length 523: 2405:204:a18c:2644:181d:419a:85f7:92eb.53696 > 2404:6800:4002:804::200e.80: Flags [P.], seq 438:875, ack 747, win 237, options [nop,nop,TS val 4294914023 ecr 1648911634], length 437
08:35:56.930676 8c:be:be:38:d8:fd > 68:a3:c4:4e:2c:bd, ethertype IPv6 (0x86dd), length 391: 2404:6800:4002:804::2003.443 > 2405:204:a18c:2644:181d:419a:85f7:92eb.38244: Flags [P.], seq 4160:4465, ack 325, win 219, options [nop,nop,TS val 1572193574 ecr 4294914023], length 305
08:35:56.930737 8c:be:be:38:d8:fd > 68:a3:c4:4e:2c:bd, ethertype IPv6 (0x86dd), length 142: 2404:6800:4002:804::2003.443 > 2405:204:a18c:2644:181d:419a:85f7:92eb.38244: Flags [P.], seq 4465:4521, ack 325, win 219, options [nop,nop,TS val 1572193574 ecr 4294914023], length 56
08:35:56.930743 8c:be:be:38:d8:fd > 68:a3:c4:4e:2c:bd, ethertype IPv6 (0x86dd), length 128: 2404:6800:4002:804::2003.443 > 2405:204:a18c:2644:181d:419a:85f7:92eb.38244: Flags [P.], seq 4521:4563, ack 325, win 219, options [nop,nop,TS val 1572193574 ecr 4294914023], length 42
08:35:56.930747 8c:be:be:38:d8:fd > 68:a3:c4:4e:2c:bd, ethertype IPv6 (0x86dd), length 86: 2404:6800:4002:804::200e.80 > 2405:204:a18c:2644:181d:419a:85f7:92eb.53696: Flags [.], ack 875, win 228, options [nop,nop,TS val 1648912198 ecr 4294914023], length 0
08:35:56.967904 68:a3:c4:4e:2c:bd > 8c:be:be:38:d8:fd, ethertype IPv6 (0x86dd), length 86: 2405:204:a18c:2644:181d:419a:85f7:92eb.38244 > 2404:6800:4002:804::2003.443: Flags [.], ack 4563, win 320, options [nop,nop,TS val 4294914055 ecr 1572193574], length 0
08:35:57.021560 8c:be:be:38:d8:fd > 68:a3:c4:4e:2c:bd, ethertype IPv6 (0x86dd), length 832: 2404:6800:4002:804::200e.80 > 2405:204:a18c:2644:181d:419a:85f7:92eb.53696: Flags [P.], seq 747:1493, ack 875, win 228, options [nop,nop,TS val 1648912287 ecr 4294914023], length 746
08:35:57.021610 68:a3:c4:4e:2c:bd > 8c:be:be:38:d8:fd, ethertype IPv6 (0x86dd), length 86: 2405:204:a18c:2644:181d:419a:85f7:92eb.53696 > 2404:6800:4002:804::200e.80: Flags [.], ack 1493, win 249, options [nop,nop,TS val 4294914068 ecr 1648912287], length 0
08:35:57.022961 68:a3:c4:4e:2c:bd > 8c:be:be:38:d8:fd, ethertype IPv6 (0x86dd), length 243: 2405:204:a18c:2644:181d:419a:85f7:92eb.38244 > 2404:6800:4002:804::2003.443: Flags [P.], seq 325:482, ack 4563, win 320, options [nop,nop,TS val 4294914068 ecr 1572193574], length 157
08:35:57.023201 68:a3:c4:4e:2c:bd > 8c:be:be:38:d8:fd, ethertype IPv6 (0x86dd), length 566: 2405:204:a18c:2644:181d:419a:85f7:92eb.38244 > 2404:6800:4002:804::2003.443: Flags [P.], seq 482:962, ack 4563, win 320, options [nop,nop,TS val 4294914068 ecr 1572193574], length 480
08:35:57.116941 8c:be:be:38:d8:fd > 68:a3:c4:4e:2c:bd, ethertype IPv6 (0x86dd), length 124: 2404:6800:4002:804::2003.443 > 2405:204:a18c:2644:181d:419a:85f7:92eb.38244: Flags [P.], seq 4563:4601, ack 482, win 228, options [nop,nop,TS val 1572193752 ecr 4294914068], length 38
08:35:57.116997 68:a3:c4:4e:2c:bd > 8c:be:be:38:d8:fd, ethertype IPv6 (0x86dd), length 86: 2405:204:a18c:2644:181d:419a:85f7:92eb.38244 > 2404:6800:4002:804::2003.443: Flags [.], ack 4601, win 320, options [nop,nop,TS val 4294914092 ecr 1572193752], length 0
08:35:57.156976 8c:be:be:38:d8:fd > 68:a3:c4:4e:2c:bd, ethertype IPv6 (0x86dd), length 86: 2404:6800:4002:804::2003.443 > 2405:204:a18c:2644:181d:419a:85f7:92eb.38244: Flags [.], ack 962, win 236, options [nop,nop,TS val 1572193795 ecr 4294914068], length 0
08:35:57.298274 8c:be:be:38:d8:fd > 68:a3:c4:4e:2c:bd, ethertype IPv6 (0x86dd), length 391: 2404:6800:4002:804::2003.443 > 2405:204:a18c:2644:181d:419a:85f7:92eb.38244: Flags [P.], seq 4601:4906, ack 962, win 236, options [nop,nop,TS val 1572193940 ecr 4294914092], length 305
08:35:57.298326 68:a3:c4:4e:2c:bd > 8c:be:be:38:d8:fd, ethertype IPv6 (0x86dd), length 86: 2405:204:a18c:2644:181d:419a:85f7:92eb.38244 > 2404:6800:4002:804::2003.443: Flags [.], ack 4906, win 339, options [nop,nop,TS val 4294914137 ecr 1572193940], length 0
08:35:57.299125 8c:be:be:38:d8:fd > 68:a3:c4:4e:2c:bd, ethertype IPv6 (0x86dd), length 1294: 2404:6800:4002:804::2003.443 > 2405:204:a18c:2644:181d:419a:85f7:92eb.38244: Flags [P.], seq 4906:6114, ack 962, win 236, options [nop,nop,TS val 1572193940 ecr 4294914092], length 1208
08:35:57.299156 68:a3:c4:4e:2c:bd > 8c:be:be:38:d8:fd, ethertype IPv6 (0x86dd), length 86: 2405:204:a18c:2644:181d:419a:85f7:92eb.38244 > 2404:6800:4002:804::2003.443: Flags [.], ack 6114, win 358, options [nop,nop,TS val 4294914137 ecr 1572193940], length 0
08:35:57.300115 8c:be:be:38:d8:fd > 68:a3:c4:4e:2c:bd, ethertype IPv6 (0x86dd), length 1294: 2404:6800:4002:804::2003.443 > 2405:204:a18c:2644:181d:419a:85f7:92eb.38244: Flags [P.], seq 6114:7322, ack 962, win 236, options [nop,nop,TS val 1572193940 ecr 4294914092], length 1208
08:35:57.300129 68:a3:c4:4e:2c:bd > 8c:be:be:38:d8:fd, ethertype IPv6 (0x86dd), length 86: 2405:204:a18c:2644:181d:419a:85f7:92eb.38244 > 2404:6800:4002:804::2003.443: Flags [.], ack 7322, win 376, options [nop,nop,TS val 4294914138 ecr 1572193940], length 0
08:35:57.302695 8c:be:be:38:d8:fd > 68:a3:c4:4e:2c:bd, ethertype IPv6 (0x86dd), length 1294: 2404:6800:4002:804::2003.443 > 2405:204:a18c:2644:181d:419a:85f7:92eb.38244: Flags [.], seq 7322:8530, ack 962, win 236, options [nop,nop,TS val 1572193940 ecr 4294914092], length 1208
08:35:57.302720 68:a3:c4:4e:2c:bd > 8c:be:be:38:d8:fd, ethertype IPv6 (0x86dd), length 86: 2405:204:a18c:2644:181d:419a:85f7:92eb.38244 > 2404:6800:4002:804::2003.443: Flags [.], ack 8530, win 395, options [nop,nop,TS val 4294914138 ecr 1572193940], length 0
08:35:57.302995 8c:be:be:38:d8:fd > 68:a3:c4:4e:2c:bd, ethertype IPv6 (0x86dd), length 1294: 2404:6800:4002:804::2003.443 > 2405:204:a18c:2644:181d:419a:85f7:92eb.38244: Flags [P.], seq 8530:9738, ack 962, win 236, options [nop,nop,TS val 1572193940 ecr 4294914092], length 1208
08:35:57.303001 68:a3:c4:4e:2c:bd > 8c:be:be:38:d8:fd, ethertype IPv6 (0x86dd), length 86: 2405:204:a18c:2644:181d:419a:85f7:92eb.38244 > 2404:6800:4002:804::2003.443: Flags [.], ack 9738, win 414, options [nop,nop,TS val 4294914138 ecr 1572193940], length 0
08:35:57.303396 8c:be:be:38:d8:fd > 68:a3:c4:4e:2c:bd, ethertype IPv6 (0x86dd), length 1294: 2404:6800:4002:804::2003.443 > 2405:204:a18c:2644:181d:419a:85f7:92eb.38244: Flags [P.], seq 9738:10946, ack 962, win 236, options [nop,nop,TS val 1572193940 ecr 4294914092], length 1208
08:35:57.303403 68:a3:c4:4e:2c:bd > 8c:be:be:38:d8:fd, ethertype IPv6 (0x86dd), length 86: 2405:204:a18c:2644:181d:419a:85f7:92eb.38244 > 2404:6800:4002:804::2003.443: Flags [.], ack 10946, win 433, options [nop,nop,TS val 4294914138 ecr 1572193940], length 0
08:35:57.304336 8c:be:be:38:d8:fd > 68:a3:c4:4e:2c:bd, ethertype IPv6 (0x86dd), length 1294: 2404:6800:4002:804::2003.443 > 2405:204:a18c:2644:181d:419a:85f7:92eb.38244: Flags [P.], seq 10946:12154, ack 962, win 236, options [nop,nop,TS val 1572193940 ecr 4294914092], length 1208
08:35:57.304350 68:a3:c4:4e:2c:bd > 8c:be:be:38:d8:fd, ethertype IPv6 (0x86dd), length 86: 2405:204:a18c:2644:181d:419a:85f7:92eb.38244 > 2404:6800:4002:804::2003.443: Flags [.], ack 12154, win 452, options [nop,nop,TS val 4294914139 ecr 1572193940], length 0
08:35:57.316988 8c:be:be:38:d8:fd > 68:a3:c4:4e:2c:bd, ethertype IPv6 (0x86dd), length 1294: 2404:6800:4002:804::2003.443 > 2405:204:a18c:2644:181d:419a:85f7:92eb.38244: Flags [P.], seq 12154:13362, ack 962, win 236, options [nop,nop,TS val 1572193940 ecr 4294914092], length 1208
08:35:57.317015 68:a3:c4:4e:2c:bd > 8c:be:be:38:d8:fd, ethertype IPv6 (0x86dd), length 86: 2405:204:a18c:2644:181d:419a:85f7:92eb.38244 > 2404:6800:4002:804::2003.443: Flags [.], ack 13362, win 471, options [nop,nop,TS val 4294914142 ecr 1572193940], length 0
08:35:57.318103 8c:be:be:38:d8:fd > 68:a3:c4:4e:2c:bd, ethertype IPv6 (0x86dd), length 1294: 2404:6800:4002:804::2003.443 > 2405:204:a18c:2644:181d:419a:85f7:92eb.38244: Flags [P.], seq 13362:14570, ack 962, win 236, options [nop,nop,TS val 1572193940 ecr 4294914092], length 1208
08:35:57.318112 68:a3:c4:4e:2c:bd > 8c:be:be:38:d8:fd, ethertype IPv6 (0x86dd), length 86: 2405:204:a18c:2644:181d:419a:85f7:92eb.38244 > 2404:6800:4002:804::2003.443: Flags [.], ack 14570, win 490, options [nop,nop,TS val 4294914142 ecr 1572193940], length 0
08:35:57.318604 8c:be:be:38:d8:fd > 68:a3:c4:4e:2c:bd, ethertype IPv6 (0x86dd), length 1294: 2404:6800:4002:804::2003.443 > 2405:204:a18c:2644:181d:419a:85f7:92eb.38244: Flags [P.], seq 14570:15778, ack 962, win 236, options [nop,nop,TS val 1572193940 ecr 4294914092], length 1208
08:35:57.318613 68:a3:c4:4e:2c:bd > 8c:be:be:38:d8:fd, ethertype IPv6 (0x86dd), length 86: 2405:204:a18c:2644:181d:419a:85f7:92eb.38244 > 2404:6800:4002:804::2003.443: Flags [.], ack 15778, win 509, options [nop,nop,TS val 4294914142 ecr 1572193940], length 0
08:35:57.322140 8c:be:be:38:d8:fd > 68:a3:c4:4e:2c:bd, ethertype IPv6 (0x86dd), length 1294: 2404:6800:4002:804::2003.443 > 2405:204:a18c:2644:181d:419a:85f7:92eb.38244: Flags [.], seq 15778:16986, ack 962, win 236, options [nop,nop,TS val 1572193941 ecr 4294914092], length 1208
08:35:57.322161 68:a3:c4:4e:2c:bd > 8c:be:be:38:d8:fd, ethertype IPv6 (0x86dd), length 86: 2405:204:a18c:2644:181d:419a:85f7:92eb.38244 > 2404:6800:4002:804::2003.443: Flags [.], ack 16986, win 527, options [nop,nop,TS val 4294914143 ecr 1572193941], length 0
08:35:57.322177 8c:be:be:38:d8:fd > 68:a3:c4:4e:2c:bd, ethertype IPv6 (0x86dd), length 860: 2404:6800:4002:804::2003.443 > 2405:204:a18c:2644:181d:419a:85f7:92eb.38244: Flags [P.], seq 16986:17760, ack 962, win 236, options [nop,nop,TS val 1572193941 ecr 4294914092], length 774
08:35:57.322184 68:a3:c4:4e:2c:bd > 8c:be:be:38:d8:fd, ethertype IPv6 (0x86dd), length 86: 2405:204:a18c:2644:181d:419a:85f7:92eb.38244 > 2404:6800:4002:804::2003.443: Flags [.], ack 17760, win 546, options [nop,nop,TS val 4294914143 ecr 1572193941], length 0
08:35:57.323173 8c:be:be:38:d8:fd > 68:a3:c4:4e:2c:bd, ethertype IPv6 (0x86dd), length 1294: 2404:6800:4002:804::2003.443 > 2405:204:a18c:2644:181d:419a:85f7:92eb.38244: Flags [.], seq 17760:18968, ack 962, win 236, options [nop,nop,TS val 1572193941 ecr 4294914092], length 1208
08:35:57.323184 68:a3:c4:4e:2c:bd > 8c:be:be:38:d8:fd, ethertype IPv6 (0x86dd), length 86: 2405:204:a18c:2644:181d:419a:85f7:92eb.38244 > 2404:6800:4002:804::2003.443: Flags [.], ack 18968, win 565, options [nop,nop,TS val 4294914143 ecr 1572193941], length 0
08:35:57.323968 8c:be:be:38:d8:fd > 68:a3:c4:4e:2c:bd, ethertype IPv6 (0x86dd), length 1294: 2404:6800:4002:804::2003.443 > 2405:204:a18c:2644:181d:419a:85f7:92eb.38244: Flags [.], seq 18968:20176, ack 962, win 236, options [nop,nop,TS val 1572193941 ecr 4294914092], length 1208
08:35:57.323983 68:a3:c4:4e:2c:bd > 8c:be:be:38:d8:fd, ethertype IPv6 (0x86dd), length 86: 2405:204:a18c:2644:181d:419a:85f7:92eb.38244 > 2404:6800:4002:804::2003.443: Flags [.], ack 20176, win 584, options [nop,nop,TS val 4294914144 ecr 1572193941], length 0
08:35:57.325120 8c:be:be:38:d8:fd > 68:a3:c4:4e:2c:bd, ethertype IPv6 (0x86dd), length 1294: 2404:6800:4002:804::2003.443 > 2405:204:a18c:2644:181d:419a:85f7:92eb.38244: Flags [.], seq 20176:21384, ack 962, win 236, options [nop,nop,TS val 1572193945 ecr 4294914092], length 1208
08:35:57.325137 68:a3:c4:4e:2c:bd > 8c:be:be:38:d8:fd, ethertype IPv6 (0x86dd), length 86: 2405:204:a18c:2644:181d:419a:85f7:92eb.38244 > 2404:6800:4002:804::2003.443: Flags [.], ack 21384, win 603, options [nop,nop,TS val 4294914144 ecr 1572193945], length 0
08:35:57.326294 8c:be:be:38:d8:fd > 68:a3:c4:4e:2c:bd, ethertype IPv6 (0x86dd), length 1294: 2404:6800:4002:804::2003.443 > 2405:204:a18c:2644:181d:419a:85f7:92eb.38244: Flags [.], seq 21384:22592, ack 962, win 236, options [nop,nop,TS val 1572193945 ecr 4294914092], length 1208
08:35:57.326305 68:a3:c4:4e:2c:bd > 8c:be:be:38:d8:fd, ethertype IPv6 (0x86dd), length 86: 2405:204:a18c:2644:181d:419a:85f7:92eb.38244 > 2404:6800:4002:804::2003.443: Flags [.], ack 22592, win 622, options [nop,nop,TS val 4294914144 ecr 1572193945], length 0
08:35:57.329764 8c:be:be:38:d8:fd > 68:a3:c4:4e:2c:bd, ethertype IPv6 (0x86dd), length 1294: 2404:6800:4002:804::2003.443 > 2405:204:a18c:2644:181d:419a:85f7:92eb.38244: Flags [.], seq 22592:23800, ack 962, win 236, options [nop,nop,TS val 1572193952 ecr 4294914092], length 1208
08:35:57.329789 68:a3:c4:4e:2c:bd > 8c:be:be:38:d8:fd, ethertype IPv6 (0x86dd), length 86: 2405:204:a18c:2644:181d:419a:85f7:92eb.38244 > 2404:6800:4002:804::2003.443: Flags [.], ack 23800, win 641, options [nop,nop,TS val 4294914145 ecr 1572193952], length 0
08:35:57.330064 8c:be:be:38:d8:fd > 68:a3:c4:4e:2c:bd, ethertype IPv6 (0x86dd), length 1294: 2404:6800:4002:804::2003.443 > 2405:204:a18c:2644:181d:419a:85f7:92eb.38244: Flags [.], seq 23800:25008, ack 962, win 236, options [nop,nop,TS val 1572193952 ecr 4294914092], length 1208
08:35:57.330074 68:a3:c4:4e:2c:bd > 8c:be:be:38:d8:fd, ethertype IPv6 (0x86dd), length 86: 2405:204:a18c:2644:181d:419a:85f7:92eb.38244 > 2404:6800:4002:804::2003.443: Flags [.], ack 25008, win 660, options [nop,nop,TS val 4294914145 ecr 1572193952], length 0
08:35:57.377346 8c:be:be:38:d8:fd > 68:a3:c4:4e:2c:bd, ethertype IPv6 (0x86dd), length 1294: 2404:6800:4002:804::2003.443 > 2405:204:a18c:2644:181d:419a:85f7:92eb.38244: Flags [.], seq 25008:26216, ack 962, win 236, options [nop,nop,TS val 1572194021 ecr 4294914137], length 1208
08:35:57.377367 68:a3:c4:4e:2c:bd > 8c:be:be:38:d8:fd, ethertype IPv6 (0x86dd), length 86: 2405:204:a18c:2644:181d:419a:85f7:92eb.38244 > 2404:6800:4002:804::2003.443: Flags [.], ack 26216, win 678, options [nop,nop,TS val 4294914157 ecr 1572194021], length 0
08:35:57.377707 8c:be:be:38:d8:fd > 68:a3:c4:4e:2c:bd, ethertype IPv6 (0x86dd), length 1294: 2404:6800:4002:804::2003.443 > 2405:204:a18c:2644:181d:419a:85f7:92eb.38244: Flags [.], seq 26216:27424, ack 962, win 236, options [nop,nop,TS val 1572194021 ecr 4294914137], length 1208
08:35:57.377714 68:a3:c4:4e:2c:bd > 8c:be:be:38:d8:fd, ethertype IPv6 (0x86dd), length 86: 2405:204:a18c:2644:181d:419a:85f7:92eb.38244 > 2404:6800:4002:804::2003.443: Flags [.], ack 27424, win 697, options [nop,nop,TS val 4294914157 ecr 1572194021], length 0
08:35:57.397715 8c:be:be:38:d8:fd > 68:a3:c4:4e:2c:bd, ethertype IPv6 (0x86dd), length 1294: 2404:6800:4002:804::2003.443 > 2405:204:a18c:2644:181d:419a:85f7:92eb.38244: Flags [.], seq 27424:28632, ack 962, win 236, options [nop,nop,TS val 1572194031 ecr 4294914137], length 1208
08:35:57.397764 68:a3:c4:4e:2c:bd > 8c:be:be:38:d8:fd, ethertype IPv6 (0x86dd), length 86: 2405:204:a18c:2644:181d:419a:85f7:92eb.38244 > 2404:6800:4002:804::2003.443: Flags [.], ack 28632, win 716, options [nop,nop,TS val 4294914162 ecr 1572194031], length 0
08:35:57.398249 8c:be:be:38:d8:fd > 68:a3:c4:4e:2c:bd, ethertype IPv6 (0x86dd), length 1294: 2404:6800:4002:804::2003.443 > 2405:204:a18c:2644:181d:419a:85f7:92eb.38244: Flags [.], seq 28632:29840, ack 962, win 236, options [nop,nop,TS val 1572194032 ecr 4294914138], length 1208
08:35:57.398280 68:a3:c4:4e:2c:bd > 8c:be:be:38:d8:fd, ethertype IPv6 (0x86dd), length 86: 2405:204:a18c:2644:181d:419a:85f7:92eb.38244 > 2404:6800:4002:804::2003.443: Flags [.], ack 29840, win 735, options [nop,nop,TS val 4294914162 ecr 1572194032], length 0
08:35:57.398320 8c:be:be:38:d8:fd > 68:a3:c4:4e:2c:bd, ethertype IPv6 (0x86dd), length 1294: 2404:6800:4002:804::2003.443 > 2405:204:a18c:2644:181d:419a:85f7:92eb.38244: Flags [.], seq 29840:31048, ack 962, win 236, options [nop,nop,TS val 1572194032 ecr 4294914138], length 1208
08:35:57.398325 68:a3:c4:4e:2c:bd > 8c:be:be:38:d8:fd, ethertype IPv6 (0x86dd), length 86: 2405:204:a18c:2644:181d:419a:85f7:92eb.38244 > 2404:6800:4002:804::2003.443: Flags [.], ack 31048, win 754, options [nop,nop,TS val 4294914162 ecr 1572194032], length 0
08:35:57.407510 8c:be:be:38:d8:fd > 68:a3:c4:4e:2c:bd, ethertype IPv6 (0x86dd), length 1294: 2404:6800:4002:804::2003.443 > 2405:204:a18c:2644:181d:419a:85f7:92eb.38244: Flags [.], seq 31048:32256, ack 962, win 236, options [nop,nop,TS val 1572194032 ecr 4294914138], length 1208
08:35:57.407534 68:a3:c4:4e:2c:bd > 8c:be:be:38:d8:fd, ethertype IPv6 (0x86dd), length 86: 2405:204:a18c:2644:181d:419a:85f7:92eb.38244 > 2404:6800:4002:804::2003.443: Flags [.], ack 32256, win 773, options [nop,nop,TS val 4294914164 ecr 1572194032], length 0
08:35:57.407618 8c:be:be:38:d8:fd > 68:a3:c4:4e:2c:bd, ethertype IPv6 (0x86dd), length 1294: 2404:6800:4002:804::2003.443 > 2405:204:a18c:2644:181d:419a:85f7:92eb.38244: Flags [.], seq 32256:33464, ack 962, win 236, options [nop,nop,TS val 1572194032 ecr 4294914138], length 1208
08:35:57.407624 68:a3:c4:4e:2c:bd > 8c:be:be:38:d8:fd, ethertype IPv6 (0x86dd), length 86: 2405:204:a18c:2644:181d:419a:85f7:92eb.38244 > 2404:6800:4002:804::2003.443: Flags [.], ack 33464, win 792, options [nop,nop,TS val 4294914164 ecr 1572194032], length 0
