14:54:06.665983 68:a3:c4:4e:2c:bd > ca:25:e1:20:df:98, ethertype IPv4 (0x0800), length 97: 192.168.43.197.57008 > 52.39.237.157.443: Flags [P.], seq 3145246994:3145247025, ack 2482616863, win 289, options [nop,nop,TS val 223440 ecr 627712640], length 31
14:54:06.666049 68:a3:c4:4e:2c:bd > ca:25:e1:20:df:98, ethertype IPv4 (0x0800), length 66: 192.168.43.197.57008 > 52.39.237.157.443: Flags [F.], seq 31, ack 1, win 289, options [nop,nop,TS val 223440 ecr 627712640], length 0
14:54:07.225711 ca:25:e1:20:df:98 > 68:a3:c4:4e:2c:bd, ethertype IPv4 (0x0800), length 97: 52.39.237.157.443 > 192.168.43.197.57008: Flags [P.], seq 1:32, ack 31, win 106, options [nop,nop,TS val 627713846 ecr 223440], length 31
14:54:07.225762 68:a3:c4:4e:2c:bd > ca:25:e1:20:df:98, ethertype IPv4 (0x0800), length 54: 192.168.43.197.57008 > 52.39.237.157.443: Flags [R], seq 3145247025, win 0, length 0
14:54:07.226505 ca:25:e1:20:df:98 > 68:a3:c4:4e:2c:bd, ethertype IPv4 (0x0800), length 66: 52.39.237.157.443 > 192.168.43.197.57008: Flags [F.], seq 32, ack 31, win 106, options [nop,nop,TS val 627713846 ecr 223440], length 0
14:54:07.226520 68:a3:c4:4e:2c:bd > ca:25:e1:20:df:98, ethertype IPv4 (0x0800), length 54: 192.168.43.197.57008 > 52.39.237.157.443: Flags [R], seq 3145247025, win 0, length 0
14:54:07.227245 ca:25:e1:20:df:98 > 68:a3:c4:4e:2c:bd, ethertype IPv4 (0x0800), length 66: 52.39.237.157.443 > 192.168.43.197.57008: Flags [.], ack 32, win 106, options [nop,nop,TS val 627713848 ecr 223440], length 0
14:54:07.227262 68:a3:c4:4e:2c:bd > ca:25:e1:20:df:98, ethertype IPv4 (0x0800), length 54: 192.168.43.197.57008 > 52.39.237.157.443: Flags [R], seq 3145247026, win 0, length 0
14:54:07.666864 68:a3:c4:4e:2c:bd > ca:25:e1:20:df:98, ethertype IPv4 (0x0800), length 66: 192.168.43.197.42162 > 117.18.237.29.80: Flags [F.], seq 200211428, ack 33397531, win 229, options [nop,nop,TS val 223690 ecr 1494645302], length 0
14:54:07.667190 68:a3:c4:4e:2c:bd > ca:25:e1:20:df:98, ethertype IPv4 (0x0800), length 66: 192.168.43.197.42160 > 117.18.237.29.80: Flags [F.], seq 2765113661, ack 3853363579, win 229, options [nop,nop,TS val 223691 ecr 1541149990], length 0
14:54:07.784083 ca:25:e1:20:df:98 > 68:a3:c4:4e:2c:bd, ethertype IPv4 (0x0800), length 66: 117.18.237.29.80 > 192.168.43.197.42162: Flags [F.], seq 1, ack 1, win 283, options [nop,nop,TS val 1494646650 ecr 223690], length 0
14:54:07.784147 68:a3:c4:4e:2c:bd > ca:25:e1:20:df:98, ethertype IPv4 (0x0800), length 66: 192.168.43.197.42162 > 117.18.237.29.80: Flags [.], ack 2, win 229, options [nop,nop,TS val 223720 ecr 1494646650], length 0
14:54:07.799032 ca:25:e1:20:df:98 > 68:a3:c4:4e:2c:bd, ethertype IPv4 (0x0800), length 66: 117.18.237.29.80 > 192.168.43.197.42160: Flags [F.], seq 1, ack 1, win 283, options [nop,nop,TS val 1541151434 ecr 223691], length 0
14:54:07.799088 68:a3:c4:4e:2c:bd > ca:25:e1:20:df:98, ethertype IPv4 (0x0800), length 66: 192.168.43.197.42160 > 117.18.237.29.80: Flags [.], ack 2, win 229, options [nop,nop,TS val 223724 ecr 1541151434], length 0
14:54:08.667069 68:a3:c4:4e:2c:bd > ca:25:e1:20:df:98, ethertype IPv4 (0x0800), length 97: 192.168.43.197.57236 > 52.222.135.184.443: Flags [P.], seq 2308160169:2308160200, ack 2528693459, win 316, options [nop,nop,TS val 223941 ecr 2508583061], length 31
14:54:08.667129 68:a3:c4:4e:2c:bd > ca:25:e1:20:df:98, ethertype IPv4 (0x0800), length 66: 192.168.43.197.57236 > 52.222.135.184.443: Flags [F.], seq 31, ack 1, win 316, options [nop,nop,TS val 223941 ecr 2508583061], length 0
14:54:08.772645 ca:25:e1:20:df:98 > 68:a3:c4:4e:2c:bd, ethertype IPv4 (0x0800), length 66: 52.222.135.184.443 > 192.168.43.197.57236: Flags [F.], seq 1, ack 31, win 118, options [nop,nop,TS val 2508583585 ecr 223941], length 0
14:54:08.772694 68:a3:c4:4e:2c:bd > ca:25:e1:20:df:98, ethertype IPv4 (0x0800), length 66: 192.168.43.197.57236 > 52.222.135.184.443: Flags [.], ack 2, win 316, options [nop,nop,TS val 223967 ecr 2508583585], length 0
14:54:08.792553 ca:25:e1:20:df:98 > 68:a3:c4:4e:2c:bd, ethertype IPv4 (0x0800), length 66: 52.222.135.184.443 > 192.168.43.197.57236: Flags [.], ack 32, win 118, options [nop,nop,TS val 2508583587 ecr 223941], length 0
14:54:12.185274 68:a3:c4:4e:2c:bd > ca:25:e1:20:df:98, ethertype IPv6 (0x86dd), length 94: 2405:204:a40b:b9da:3105:682:a850:44d5.44254 > 2404:6800:4003:808::2004.443: Flags [S], seq 3182625612, win 28800, options [mss 1440,sackOK,TS val 224820 ecr 0,nop,wscale 7], length 0
14:54:12.200886 68:a3:c4:4e:2c:bd > ca:25:e1:20:df:98, ethertype IPv4 (0x0800), length 62: 192.168.43.197.28131 > 192.168.43.1.53: 34655+ A? fb. (20)
14:54:12.384114 ca:25:e1:20:df:98 > 68:a3:c4:4e:2c:bd, ethertype IPv6 (0x86dd), length 94: 2404:6800:4003:808::2004.443 > 2405:204:a40b:b9da:3105:682:a850:44d5.44254: Flags [S.], seq 2592807473, ack 3182625613, win 26960, options [mss 1360,sackOK,TS val 51133188 ecr 224820,nop,wscale 7], length 0
14:54:12.384172 68:a3:c4:4e:2c:bd > ca:25:e1:20:df:98, ethertype IPv6 (0x86dd), length 86: 2405:204:a40b:b9da:3105:682:a850:44d5.44254 > 2404:6800:4003:808::2004.443: Flags [.], ack 1, win 225, options [nop,nop,TS val 224870 ecr 51133188], length 0
14:54:12.384603 68:a3:c4:4e:2c:bd > ca:25:e1:20:df:98, ethertype IPv6 (0x86dd), length 282: 2405:204:a40b:b9da:3105:682:a850:44d5.44254 > 2404:6800:4003:808::2004.443: Flags [P.], seq 1:197, ack 1, win 225, options [nop,nop,TS val 224870 ecr 51133188], length 196
14:54:12.610587 ca:25:e1:20:df:98 > 68:a3:c4:4e:2c:bd, ethertype IPv6 (0x86dd), length 86: 2404:6800:4003:808::2004.443 > 2405:204:a40b:b9da:3105:682:a850:44d5.44254: Flags [.], ack 197, win 219, options [nop,nop,TS val 51133427 ecr 224870], length 0
14:54:12.610906 68:a3:c4:4e:2c:bd > ca:25:e1:20:df:98, ethertype IPv4 (0x0800), length 66: 192.168.43.197.42158 > 117.18.237.29.80: Flags [.], ack 2540442290, win 253, options [nop,nop,TS val 224927 ecr 3498344481], length 0
14:54:12.615695 ca:25:e1:20:df:98 > 68:a3:c4:4e:2c:bd, ethertype IPv6 (0x86dd), length 1294: 2404:6800:4003:808::2004.443 > 2405:204:a40b:b9da:3105:682:a850:44d5.44254: Flags [.], seq 1:1209, ack 197, win 219, options [nop,nop,TS val 51133428 ecr 224870], length 1208
14:54:12.615747 68:a3:c4:4e:2c:bd > ca:25:e1:20:df:98, ethertype IPv6 (0x86dd), length 86: 2405:204:a40b:b9da:3105:682:a850:44d5.44254 > 2404:6800:4003:808::2004.443: Flags [.], ack 1209, win 244, options [nop,nop,TS val 224928 ecr 51133428], length 0
14:54:12.705798 ca:25:e1:20:df:98 > 68:a3:c4:4e:2c:bd, ethertype IPv6 (0x86dd), length 1294: 2404:6800:4003:808::2004.443 > 2405:204:a40b:b9da:3105:682:a850:44d5.44254: Flags [.], seq 1209:2417, ack 197, win 219, options [nop,nop,TS val 51133428 ecr 224870], length 1208
14:54:12.705854 68:a3:c4:4e:2c:bd > ca:25:e1:20:df:98, ethertype IPv6 (0x86dd), length 86: 2405:204:a40b:b9da:3105:682:a850:44d5.44254 > 2404:6800:4003:808::2004.443: Flags [.], ack 2417, win 263, options [nop,nop,TS val 224950 ecr 51133428], length 0
14:54:12.785818 ca:25:e1:20:df:98 > 68:a3:c4:4e:2c:bd, ethertype IPv6 (0x86dd), length 1236: 2404:6800:4003:808::2004.443 > 2405:204:a40b:b9da:3105:682:a850:44d5.44254: Flags [P.], seq 2417:3567, ack 197, win 219, options [nop,nop,TS val 51133428 ecr 224870], length 1150
14:54:12.785870 68:a3:c4:4e:2c:bd > ca:25:e1:20:df:98, ethertype IPv6 (0x86dd), length 86: 2405:204:a40b:b9da:3105:682:a850:44d5.44254 > 2404:6800:4003:808::2004.443: Flags [.], ack 3567, win 282, options [nop,nop,TS val 224970 ecr 51133428], length 0
14:54:12.785924 ca:25:e1:20:df:98 > 68:a3:c4:4e:2c:bd, ethertype IPv4 (0x0800), length 66: 117.18.237.29.80 > 192.168.43.197.42158: Flags [.], ack 1, win 287, options [nop,nop,TS val 3498347013 ecr 222339], length 0
14:54:12.796468 68:a3:c4:4e:2c:bd > ca:25:e1:20:df:98, ethertype IPv4 (0x0800), length 79: 192.168.43.197.47677 > 192.168.43.1.53: 50396+ A? clients1.google.com. (37)
14:54:12.796654 68:a3:c4:4e:2c:bd > ca:25:e1:20:df:98, ethertype IPv4 (0x0800), length 79: 192.168.43.197.43535 > 192.168.43.1.53: 4389+ AAAA? clients1.google.com. (37)
14:54:12.798255 68:a3:c4:4e:2c:bd > ca:25:e1:20:df:98, ethertype IPv6 (0x86dd), length 212: 2405:204:a40b:b9da:3105:682:a850:44d5.44254 > 2404:6800:4003:808::2004.443: Flags [P.], seq 197:323, ack 3567, win 282, options [nop,nop,TS val 224973 ecr 51133428], length 126
14:54:13.022942 68:a3:c4:4e:2c:bd > ca:25:e1:20:df:98, ethertype IPv4 (0x0800), length 66: 192.168.43.197.57006 > 52.39.237.157.443: Flags [.], ack 2587362094, win 309, options [nop,nop,TS val 225030 ecr 627712842], length 0
14:54:13.050105 ca:25:e1:20:df:98 > 68:a3:c4:4e:2c:bd, ethertype IPv4 (0x0800), length 119: 192.168.43.1.53 > 192.168.43.197.47677: 50396 2/0/0 CNAME clients.l.google.com., A 216.58.199.142 (77)
14:54:13.059628 ca:25:e1:20:df:98 > 68:a3:c4:4e:2c:bd, ethertype IPv6 (0x86dd), length 348: 2404:6800:4003:808::2004.443 > 2405:204:a40b:b9da:3105:682:a850:44d5.44254: Flags [P.], seq 3567:3829, ack 323, win 219, options [nop,nop,TS val 51133878 ecr 224973], length 262
14:54:13.060186 ca:25:e1:20:df:98 > 68:a3:c4:4e:2c:bd, ethertype IPv6 (0x86dd), length 142: 2404:6800:4003:808::2004.443 > 2405:204:a40b:b9da:3105:682:a850:44d5.44254: Flags [P.], seq 3829:3885, ack 323, win 219, options [nop,nop,TS val 51133878 ecr 224973], length 56
14:54:13.060214 ca:25:e1:20:df:98 > 68:a3:c4:4e:2c:bd, ethertype IPv6 (0x86dd), length 128: 2404:6800:4003:808::2004.443 > 2405:204:a40b:b9da:3105:682:a850:44d5.44254: Flags [P.], seq 3885:3927, ack 323, win 219, options [nop,nop,TS val 51133878 ecr 224973], length 42
14:54:13.098901 68:a3:c4:4e:2c:bd > ca:25:e1:20:df:98, ethertype IPv6 (0x86dd), length 86: 2405:204:a40b:b9da:3105:682:a850:44d5.44254 > 2404:6800:4003:808::2004.443: Flags [.], ack 3927, win 301, options [nop,nop,TS val 225049 ecr 51133878], length 0
14:54:13.130045 ca:25:e1:20:df:98 > 68:a3:c4:4e:2c:bd, ethertype IPv4 (0x0800), length 131: 192.168.43.1.53 > 192.168.43.197.43535: 4389 2/0/0 CNAME clients.l.google.com., AAAA 2404:6800:4009:806::200e (89)
14:54:13.130829 68:a3:c4:4e:2c:bd > ca:25:e1:20:df:98, ethertype IPv6 (0x86dd), length 94: 2405:204:a40b:b9da:3105:682:a850:44d5.33372 > 2404:6800:4009:806::200e.80: Flags [S], seq 495456091, win 28800, options [mss 1440,sackOK,TS val 225056 ecr 0,nop,wscale 7], length 0
14:54:13.319029 ca:25:e1:20:df:98 > 68:a3:c4:4e:2c:bd, ethertype IPv6 (0x86dd), length 94: 2404:6800:4009:806::200e.80 > 2405:204:a40b:b9da:3105:682:a850:44d5.33372: Flags [S.], seq 1389741127, ack 495456092, win 26960, options [mss 1360,sackOK,TS val 2260854568 ecr 225056,nop,wscale 7], length 0
14:54:13.319124 68:a3:c4:4e:2c:bd > ca:25:e1:20:df:98, ethertype IPv6 (0x86dd), length 86: 2405:204:a40b:b9da:3105:682:a850:44d5.33372 > 2404:6800:4009:806::200e.80: Flags [.], ack 1, win 225, options [nop,nop,TS val 225104 ecr 2260854568], length 0
14:54:13.319471 68:a3:c4:4e:2c:bd > ca:25:e1:20:df:98, ethertype IPv6 (0x86dd), length 523: 2405:204:a40b:b9da:3105:682:a850:44d5.33372 > 2404:6800:4009:806::200e.80: Flags [P.], seq 1:438, ack 1, win 225, options [nop,nop,TS val 225104 ecr 2260854568], length 437
14:54:13.454613 ca:25:e1:20:df:98 > 68:a3:c4:4e:2c:bd, ethertype IPv4 (0x0800), length 66: 52.39.237.157.443 > 192.168.43.197.57006: Flags [.], ack 1, win 110, options [nop,nop,TS val 627715451 ecr 222418], length 0
14:54:13.639097 ca:25:e1:20:df:98 > 68:a3:c4:4e:2c:bd, ethertype IPv6 (0x86dd), length 86: 2404:6800:4009:806::200e.80 > 2405:204:a40b:b9da:3105:682:a850:44d5.33372: Flags [.], ack 438, win 219, options [nop,nop,TS val 2260854898 ecr 225104], length 0
14:54:13.700684 ca:25:e1:20:df:98 > 68:a3:c4:4e:2c:bd, ethertype IPv6 (0x86dd), length 832: 2404:6800:4009:806::200e.80 > 2405:204:a40b:b9da:3105:682:a850:44d5.33372: Flags [P.], seq 1:747, ack 438, win 219, options [nop,nop,TS val 2260854957 ecr 225104], length 746
14:54:13.700731 68:a3:c4:4e:2c:bd > ca:25:e1:20:df:98, ethertype IPv6 (0x86dd), length 86: 2405:204:a40b:b9da:3105:682:a850:44d5.33372 > 2404:6800:4009:806::200e.80: Flags [.], ack 747, win 237, options [nop,nop,TS val 225199 ecr 2260854957], length 0
14:54:13.703257 68:a3:c4:4e:2c:bd > ca:25:e1:20:df:98, ethertype IPv6 (0x86dd), length 243: 2405:204:a40b:b9da:3105:682:a850:44d5.44254 > 2404:6800:4003:808::2004.443: Flags [P.], seq 323:480, ack 3927, win 301, options [nop,nop,TS val 225200 ecr 51133878], length 157
14:54:13.703733 68:a3:c4:4e:2c:bd > ca:25:e1:20:df:98, ethertype IPv6 (0x86dd), length 713: 2405:204:a40b:b9da:3105:682:a850:44d5.44254 > 2404:6800:4003:808::2004.443: Flags [P.], seq 480:1107, ack 3927, win 301, options [nop,nop,TS val 225200 ecr 51133878], length 627
14:54:13.937412 ca:25:e1:20:df:98 > 68:a3:c4:4e:2c:bd, ethertype IPv6 (0x86dd), length 124: 2404:6800:4003:808::2004.443 > 2405:204:a40b:b9da:3105:682:a850:44d5.44254: Flags [P.], seq 3927:3965, ack 480, win 228, options [nop,nop,TS val 51134757 ecr 225200], length 38
14:54:13.937487 68:a3:c4:4e:2c:bd > ca:25:e1:20:df:98, ethertype IPv6 (0x86dd), length 86: 2405:204:a40b:b9da:3105:682:a850:44d5.44254 > 2404:6800:4003:808::2004.443: Flags [.], ack 3965, win 301, options [nop,nop,TS val 225258 ecr 51134757], length 0
14:54:14.384672 ca:25:e1:20:df:98 > 68:a3:c4:4e:2c:bd, ethertype IPv6 (0x86dd), length 163: 2405:200:1611:2885:face:b00c:0:a7.443 > 2405:204:a40b:b9da:3105:682:a850:44d5.52210: Flags [FP.], seq 3384386061:3384386138, ack 3388891392, win 118, options [nop,nop,TS val 881073280 ecr 220194], length 77
14:54:14.384729 68:a3:c4:4e:2c:bd > ca:25:e1:20:df:98, ethertype IPv6 (0x86dd), length 74: 2405:204:a40b:b9da:3105:682:a850:44d5.52210 > 2405:200:1611:2885:face:b00c:0:a7.443: Flags [R], seq 3388891392, win 0, length 0
14:54:14.455712 ca:25:e1:20:df:98 > 68:a3:c4:4e:2c:bd, ethertype IPv6 (0x86dd), length 124: 2404:6800:4003:808::2004.443 > 2405:204:a40b:b9da:3105:682:a850:44d5.44254: Flags [P.], seq 3927:3965, ack 480, win 228, options [nop,nop,TS val 51135276 ecr 225200], length 38
14:54:14.455769 68:a3:c4:4e:2c:bd > ca:25:e1:20:df:98, ethertype IPv6 (0x86dd), length 98: 2405:204:a40b:b9da:3105:682:a850:44d5.44254 > 2404:6800:4003:808::2004.443: Flags [.], ack 3965, win 301, options [nop,nop,TS val 225388 ecr 51135276,nop,nop,sack 1 {3927:3965}], length 0
14:54:14.609748 ca:25:e1:20:df:98 > 68:a3:c4:4e:2c:bd, ethertype IPv6 (0x86dd), length 339: 2404:6800:4003:808::2004.443 > 2405:204:a40b:b9da:3105:682:a850:44d5.44254: Flags [P.], seq 3965:4218, ack 1107, win 238, options [nop,nop,TS val 51135429 ecr 225200], length 253
14:54:14.609828 68:a3:c4:4e:2c:bd > ca:25:e1:20:df:98, ethertype IPv6 (0x86dd), length 86: 2405:204:a40b:b9da:3105:682:a850:44d5.44254 > 2404:6800:4003:808::2004.443: Flags [.], ack 4218, win 320, options [nop,nop,TS val 225426 ecr 51135429], length 0
14:54:14.610131 ca:25:e1:20:df:98 > 68:a3:c4:4e:2c:bd, ethertype IPv6 (0x86dd), length 458: 2404:6800:4003:808::2004.443 > 2405:204:a40b:b9da:3105:682:a850:44d5.44254: Flags [P.], seq 4218:4590, ack 1107, win 238, options [nop,nop,TS val 51135429 ecr 225200], length 372
14:54:14.610155 68:a3:c4:4e:2c:bd > ca:25:e1:20:df:98, ethertype IPv6 (0x86dd), length 86: 2405:204:a40b:b9da:3105:682:a850:44d5.44254 > 2404:6800:4003:808::2004.443: Flags [.], ack 4590, win 339, options [nop,nop,TS val 225426 ecr 51135429], length 0
14:54:14.610973 ca:25:e1:20:df:98 > 68:a3:c4:4e:2c:bd, ethertype IPv6 (0x86dd), length 132: 2404:6800:4003:808::2004.443 > 2405:204:a40b:b9da:3105:682:a850:44d5.44254: Flags [P.], seq 4590:4636, ack 1107, win 238, options [nop,nop,TS val 51135429 ecr 225200], length 46
14:54:14.610992 68:a3:c4:4e:2c:bd > ca:25:e1:20:df:98, ethertype IPv6 (0x86dd), length 86: 2405:204:a40b:b9da:3105:682:a850:44d5.44254 > 2404:6800:4003:808::2004.443: Flags [.], ack 4636, win 339, options [nop,nop,TS val 225427 ecr 51135429], length 0
14:54:14.611373 68:a3:c4:4e:2c:bd > ca:25:e1:20:df:98, ethertype IPv6 (0x86dd), length 132: 2405:204:a40b:b9da:3105:682:a850:44d5.44254 > 2404:6800:4003:808::2004.443: Flags [P.], seq 1107:1153, ack 4636, win 339, options [nop,nop,TS val 225427 ecr 51135429], length 46
14:54:14.614975 68:a3:c4:4e:2c:bd > ca:25:e1:20:df:98, ethertype IPv4 (0x0800), length 76: 192.168.43.197.39406 > 192.168.43.1.53: 30165+ A? www.google.co.in. (34)
14:54:14.769797 ca:25:e1:20:df:98 > 68:a3:c4:4e:2c:bd, ethertype IPv4 (0x0800), length 92: 192.168.43.1.53 > 192.168.43.197.39406: 30165 1/0/0 A 172.217.24.67 (50)
14:54:14.770147 68:a3:c4:4e:2c:bd > ca:25:e1:20:df:98, ethertype IPv4 (0x0800), length 76: 192.168.43.197.55247 > 192.168.43.1.53: 40778+ AAAA? www.google.co.in. (34)
14:54:14.864896 ca:25:e1:20:df:98 > 68:a3:c4:4e:2c:bd, ethertype IPv4 (0x0800), length 104: 192.168.43.1.53 > 192.168.43.197.55247: 40778 1/0/0 AAAA 2404:6800:4003:805::2003 (62)
14:54:14.865605 68:a3:c4:4e:2c:bd > ca:25:e1:20:df:98, ethertype IPv6 (0x86dd), length 94: 2405:204:a40b:b9da:3105:682:a850:44d5.45644 > 2404:6800:4003:805::2003.443: Flags [S], seq 2046351623, win 28800, options [mss 1440,sackOK,TS val 225490 ecr 0,nop,wscale 7], length 0
14:54:14.889667 ca:25:e1:20:df:98 > 68:a3:c4:4e:2c:bd, ethertype IPv6 (0x86dd), length 86: 2404:6800:4003:808::2004.443 > 2405:204:a40b:b9da:3105:682:a850:44d5.44254: Flags [.], ack 1153, win 238, options [nop,nop,TS val 51135697 ecr 225427], length 0
14:54:15.049559 ca:25:e1:20:df:98 > 68:a3:c4:4e:2c:bd, ethertype IPv6 (0x86dd), length 94: 2404:6800:4003:805::2003.443 > 2405:204:a40b:b9da:3105:682:a850:44d5.45644: Flags [S.], seq 4150141779, ack 2046351624, win 26960, options [mss 1360,sackOK,TS val 2917183179 ecr 225490,nop,wscale 7], length 0
14:54:15.049668 68:a3:c4:4e:2c:bd > ca:25:e1:20:df:98, ethertype IPv6 (0x86dd), length 86: 2405:204:a40b:b9da:3105:682:a850:44d5.45644 > 2404:6800:4003:805::2003.443: Flags [.], ack 1, win 225, options [nop,nop,TS val 225536 ecr 2917183179], length 0
14:54:15.050404 68:a3:c4:4e:2c:bd > ca:25:e1:20:df:98, ethertype IPv6 (0x86dd), length 284: 2405:204:a40b:b9da:3105:682:a850:44d5.45644 > 2404:6800:4003:805::2003.443: Flags [P.], seq 1:199, ack 1, win 225, options [nop,nop,TS val 225536 ecr 2917183179], length 198
14:54:15.290667 ca:25:e1:20:df:98 > 68:a3:c4:4e:2c:bd, ethertype IPv6 (0x86dd), length 86: 2404:6800:4003:805::2003.443 > 2405:204:a40b:b9da:3105:682:a850:44d5.45644: Flags [.], ack 199, win 219, options [nop,nop,TS val 2917183425 ecr 225536], length 0
14:54:15.295661 ca:25:e1:20:df:98 > 68:a3:c4:4e:2c:bd, ethertype IPv6 (0x86dd), length 1294: 2404:6800:4003:805::2003.443 > 2405:204:a40b:b9da:3105:682:a850:44d5.45644: Flags [.], seq 1:1209, ack 199, win 219, options [nop,nop,TS val 2917183425 ecr 225536], length 1208
14:54:15.295711 68:a3:c4:4e:2c:bd > ca:25:e1:20:df:98, ethertype IPv6 (0x86dd), length 86: 2405:204:a40b:b9da:3105:682:a850:44d5.45644 > 2404:6800:4003:805::2003.443: Flags [.], ack 1209, win 244, options [nop,nop,TS val 225598 ecr 2917183425], length 0
14:54:15.375692 ca:25:e1:20:df:98 > 68:a3:c4:4e:2c:bd, ethertype IPv6 (0x86dd), length 1294: 2404:6800:4003:805::2003.443 > 2405:204:a40b:b9da:3105:682:a850:44d5.45644: Flags [.], seq 1209:2417, ack 199, win 219, options [nop,nop,TS val 2917183425 ecr 225536], length 1208
14:54:15.375731 68:a3:c4:4e:2c:bd > ca:25:e1:20:df:98, ethertype IPv6 (0x86dd), length 86: 2405:204:a40b:b9da:3105:682:a850:44d5.45644 > 2404:6800:4003:805::2003.443: Flags [.], ack 2417, win 263, options [nop,nop,TS val 225618 ecr 2917183425], length 0
14:54:15.416842 ca:25:e1:20:df:98 > 68:a3:c4:4e:2c:bd, ethertype IPv6 (0x86dd), length 1294: 2404:6800:4003:805::2003.443 > 2405:204:a40b:b9da:3105:682:a850:44d5.45644: Flags [.], seq 2417:3625, ack 199, win 219, options [nop,nop,TS val 2917183425 ecr 225536], length 1208
14:54:15.416897 68:a3:c4:4e:2c:bd > ca:25:e1:20:df:98, ethertype IPv6 (0x86dd), length 86: 2405:204:a40b:b9da:3105:682:a850:44d5.45644 > 2404:6800:4003:805::2003.443: Flags [.], ack 3625, win 282, options [nop,nop,TS val 225628 ecr 2917183425], length 0
14:54:15.470649 ca:25:e1:20:df:98 > 68:a3:c4:4e:2c:bd, ethertype IPv6 (0x86dd), length 656: 2404:6800:4003:805::2003.443 > 2405:204:a40b:b9da:3105:682:a850:44d5.45644: Flags [P.], seq 3625:4195, ack 199, win 219, options [nop,nop,TS val 2917183425 ecr 225536], length 570
14:54:15.470706 68:a3:c4:4e:2c:bd > ca:25:e1:20:df:98, ethertype IPv6 (0x86dd), length 86: 2405:204:a40b:b9da:3105:682:a850:44d5.45644 > 2404:6800:4003:805::2003.443: Flags [.], ack 4195, win 301, options [nop,nop,TS val 225641 ecr 2917183425], length 0
14:54:15.482958 68:a3:c4:4e:2c:bd > ca:25:e1:20:df:98, ethertype IPv6 (0x86dd), length 212: 2405:204:a40b:b9da:3105:682:a850:44d5.45644 > 2404:6800:4003:805::2003.443: Flags [P.], seq 199:325, ack 4195, win 301, options [nop,nop,TS val 225645 ecr 2917183425], length 126
14:54:15.483126 68:a3:c4:4e:2c:bd > ca:25:e1:20:df:98, ethertype IPv6 (0x86dd), length 523: 2405:204:a40b:b9da:3105:682:a850:44d5.33372 > 2404:6800:4009:806::200e.80: Flags [P.], seq 438:875, ack 747, win 237, options [nop,nop,TS val 225645 ecr 2260854957], length 437
14:54:15.744007 ca:25:e1:20:df:98 > 68:a3:c4:4e:2c:bd, ethertype IPv6 (0x86dd), length 348: 2404:6800:4003:805::2003.443 > 2405:204:a40b:b9da:3105:682:a850:44d5.45644: Flags [P.], seq 4195:4457, ack 325, win 219, options [nop,nop,TS val 2917183880 ecr 225645], length 262
14:54:15.744064 ca:25:e1:20:df:98 > 68:a3:c4:4e:2c:bd, ethertype IPv6 (0x86dd), length 142: 2404:6800:4003:805::2003.443 > 2405:204:a40b:b9da:3105:682:a850:44d5.45644: Flags [P.], seq 4457:4513, ack 325, win 219, options [nop,nop,TS val 2917183880 ecr 225645], length 56
14:54:15.744685 ca:25:e1:20:df:98 > 68:a3:c4:4e:2c:bd, ethertype IPv6 (0x86dd), length 128: 2404:6800:4003:805::2003.443 > 2405:204:a40b:b9da:3105:682:a850:44d5.45644: Flags [P.], seq 4513:4555, ack 325, win 219, options [nop,nop,TS val 2917183880 ecr 225645], length 42
14:54:15.782928 68:a3:c4:4e:2c:bd > ca:25:e1:20:df:98, ethertype IPv6 (0x86dd), length 86: 2405:204:a40b:b9da:3105:682:a850:44d5.45644 > 2404:6800:4003:805::2003.443: Flags [.], ack 4555, win 320, options [nop,nop,TS val 225720 ecr 2917183880], length 0
14:54:15.879059 ca:25:e1:20:df:98 > 68:a3:c4:4e:2c:bd, ethertype IPv6 (0x86dd), length 86: 2404:6800:4009:806::200e.80 > 2405:204:a40b:b9da:3105:682:a850:44d5.33372: Flags [.], ack 875, win 228, options [nop,nop,TS val 2260857138 ecr 225645], length 0
14:54:15.950544 ca:25:e1:20:df:98 > 68:a3:c4:4e:2c:bd, ethertype IPv6 (0x86dd), length 832: 2404:6800:4009:806::200e.80 > 2405:204:a40b:b9da:3105:682:a850:44d5.33372: Flags [P.], seq 747:1493, ack 875, win 228, options [nop,nop,TS val 2260857208 ecr 225645], length 746
14:54:15.950593 68:a3:c4:4e:2c:bd > ca:25:e1:20:df:98, ethertype IPv6 (0x86dd), length 86: 2405:204:a40b:b9da:3105:682:a850:44d5.33372 > 2404:6800:4009:806::200e.80: Flags [.], ack 1493, win 249, options [nop,nop,TS val 225761 ecr 2260857208], length 0
14:54:15.953828 68:a3:c4:4e:2c:bd > ca:25:e1:20:df:98, ethertype IPv6 (0x86dd), length 243: 2405:204:a40b:b9da:3105:682:a850:44d5.45644 > 2404:6800:4003:805::2003.443: Flags [P.], seq 325:482, ack 4555, win 320, options [nop,nop,TS val 225762 ecr 2917183880], length 157
14:54:15.954096 68:a3:c4:4e:2c:bd > ca:25:e1:20:df:98, ethertype IPv6 (0x86dd), length 491: 2405:204:a40b:b9da:3105:682:a850:44d5.45644 > 2404:6800:4003:805::2003.443: Flags [P.], seq 482:887, ack 4555, win 320, options [nop,nop,TS val 225762 ecr 2917183880], length 405
14:54:15.955938 68:a3:c4:4e:2c:bd > ca:25:e1:20:df:98, ethertype IPv6 (0x86dd), length 124: 2405:204:a40b:b9da:3105:682:a850:44d5.45644 > 2404:6800:4003:805::2003.443: Flags [P.], seq 887:925, ack 4555, win 320, options [nop,nop,TS val 225763 ecr 2917183880], length 38
14:54:16.219086 ca:25:e1:20:df:98 > 68:a3:c4:4e:2c:bd, ethertype IPv6 (0x86dd), length 124: 2404:6800:4003:805::2003.443 > 2405:204:a40b:b9da:3105:682:a850:44d5.45644: Flags [P.], seq 4555:4593, ack 482, win 228, options [nop,nop,TS val 2917184355 ecr 225762], length 38
14:54:16.219135 68:a3:c4:4e:2c:bd > ca:25:e1:20:df:98, ethertype IPv6 (0x86dd), length 86: 2405:204:a40b:b9da:3105:682:a850:44d5.45644 > 2404:6800:4003:805::2003.443: Flags [.], ack 4593, win 320, options [nop,nop,TS val 225829 ecr 2917184355], length 0
14:54:16.454725 ca:25:e1:20:df:98 > 68:a3:c4:4e:2c:bd, ethertype IPv6 (0x86dd), length 86: 2404:6800:4003:805::2003.443 > 2405:204:a40b:b9da:3105:682:a850:44d5.45644: Flags [.], ack 887, win 236, options [nop,nop,TS val 2917184590 ecr 225762], length 0
14:54:16.489506 ca:25:e1:20:df:98 > 68:a3:c4:4e:2c:bd, ethertype IPv6 (0x86dd), length 86: 2404:6800:4003:805::2003.443 > 2405:204:a40b:b9da:3105:682:a850:44d5.45644: Flags [.], ack 925, win 236, options [nop,nop,TS val 2917184620 ecr 225763], length 0
14:54:16.510655 ca:25:e1:20:df:98 > 68:a3:c4:4e:2c:bd, ethertype IPv6 (0x86dd), length 287: 2404:6800:4003:805::2003.443 > 2405:204:a40b:b9da:3105:682:a850:44d5.45644: Flags [P.], seq 4593:4794, ack 925, win 236, options [nop,nop,TS val 2917184646 ecr 225763], length 201
14:54:16.510707 68:a3:c4:4e:2c:bd > ca:25:e1:20:df:98, ethertype IPv6 (0x86dd), length 86: 2405:204:a40b:b9da:3105:682:a850:44d5.45644 > 2404:6800:4003:805::2003.443: Flags [.], ack 4794, win 339, options [nop,nop,TS val 225901 ecr 2917184646], length 0
14:54:16.514790 ca:25:e1:20:df:98 > 68:a3:c4:4e:2c:bd, ethertype IPv6 (0x86dd), length 1294: 2404:6800:4003:805::2003.443 > 2405:204:a40b:b9da:3105:682:a850:44d5.45644: Flags [P.], seq 4794:6002, ack 925, win 236, options [nop,nop,TS val 2917184646 ecr 225763], length 1208
14:54:16.514821 68:a3:c4:4e:2c:bd > ca:25:e1:20:df:98, ethertype IPv6 (0x86dd), length 86: 2405:204:a40b:b9da:3105:682:a850:44d5.45644 > 2404:6800:4003:805::2003.443: Flags [.], ack 6002, win 358, options [nop,nop,TS val 225902 ecr 2917184646], length 0
14:54:16.586683 ca:25:e1:20:df:98 > 68:a3:c4:4e:2c:bd, ethertype IPv6 (0x86dd), length 1294: 2404:6800:4003:805::2003.443 > 2405:204:a40b:b9da:3105:682:a850:44d5.45644: Flags [P.], seq 6002:7210, ack 925, win 236, options [nop,nop,TS val 2917184646 ecr 225763], length 1208
14:54:16.586715 68:a3:c4:4e:2c:bd > ca:25:e1:20:df:98, ethertype IPv6 (0x86dd), length 86: 2405:204:a40b:b9da:3105:682:a850:44d5.45644 > 2404:6800:4003:805::2003.443: Flags [.], ack 7210, win 376, options [nop,nop,TS val 225920 ecr 2917184646], length 0
14:54:16.655807 ca:25:e1:20:df:98 > 68:a3:c4:4e:2c:bd, ethertype IPv6 (0x86dd), length 1294: 2404:6800:4003:805::2003.443 > 2405:204:a40b:b9da:3105:682:a850:44d5.45644: Flags [P.], seq 7210:8418, ack 925, win 236, options [nop,nop,TS val 2917184646 ecr 225763], length 1208
14:54:16.655857 68:a3:c4:4e:2c:bd > ca:25:e1:20:df:98, ethertype IPv6 (0x86dd), length 86: 2405:204:a40b:b9da:3105:682:a850:44d5.45644 > 2404:6800:4003:805::2003.443: Flags [.], ack 8418, win 395, options [nop,nop,TS val 225938 ecr 2917184646], length 0
14:54:16.700715 ca:25:e1:20:df:98 > 68:a3:c4:4e:2c:bd, ethertype IPv6 (0x86dd), length 1294: 2404:6800:4003:805::2003.443 > 2405:204:a40b:b9da:3105:682:a850:44d5.45644: Flags [P.], seq 8418:9626, ack 925, win 236, options [nop,nop,TS val 2917184646 ecr 225763], length 1208
14:54:16.700744 68:a3:c4:4e:2c:bd > ca:25:e1:20:df:98, ethertype IPv6 (0x86dd), length 86: 2405:204:a40b:b9da:3105:682:a850:44d5.45644 > 2404:6800:4003:805::2003.443: Flags [.], ack 9626, win 414, options [nop,nop,TS val 225949 ecr 2917184646], length 0
14:54:16.771883 ca:25:e1:20:df:98 > 68:a3:c4:4e:2c:bd, ethertype IPv6 (0x86dd), length 1294: 2404:6800:4003:805::2003.443 > 2405:204:a40b:b9da:3105:682:a850:44d5.45644: Flags [P.], seq 9626:10834, ack 925, win 236, options [nop,nop,TS val 2917184646 ecr 225763], length 1208
14:54:16.771927 68:a3:c4:4e:2c:bd > ca:25:e1:20:df:98, ethertype IPv6 (0x86dd), length 86: 2405:204:a40b:b9da:3105:682:a850:44d5.45644 > 2404:6800:4003:805::2003.443: Flags [.], ack 10834, win 433, options [nop,nop,TS val 225967 ecr 2917184646], length 0
14:54:16.835711 ca:25:e1:20:df:98 > 68:a3:c4:4e:2c:bd, ethertype IPv6 (0x86dd), length 1294: 2404:6800:4003:805::2003.443 > 2405:204:a40b:b9da:3105:682:a850:44d5.45644: Flags [P.], seq 10834:12042, ack 925, win 236, options [nop,nop,TS val 2917184646 ecr 225763], length 1208
14:54:16.835749 68:a3:c4:4e:2c:bd > ca:25:e1:20:df:98, ethertype IPv6 (0x86dd), length 86: 2405:204:a40b:b9da:3105:682:a850:44d5.45644 > 2404:6800:4003:805::2003.443: Flags [.], ack 12042, win 452, options [nop,nop,TS val 225983 ecr 2917184646], length 0
14:54:16.891861 ca:25:e1:20:df:98 > 68:a3:c4:4e:2c:bd, ethertype IPv6 (0x86dd), length 1294: 2404:6800:4003:805::2003.443 > 2405:204:a40b:b9da:3105:682:a850:44d5.45644: Flags [.], seq 12042:13250, ack 925, win 236, options [nop,nop,TS val 2917184646 ecr 225763], length 1208
14:54:16.891900 68:a3:c4:4e:2c:bd > ca:25:e1:20:df:98, ethertype IPv6 (0x86dd), length 86: 2405:204:a40b:b9da:3105:682:a850:44d5.45644 > 2404:6800:4003:805::2003.443: Flags [.], ack 13250, win 471, options [nop,nop,TS val 225997 ecr 2917184646], length 0
14:54:16.931924 ca:25:e1:20:df:98 > 68:a3:c4:4e:2c:bd, ethertype IPv6 (0x86dd), length 1294: 2404:6800:4003:805::2003.443 > 2405:204:a40b:b9da:3105:682:a850:44d5.45644: Flags [P.], seq 13250:14458, ack 925, win 236, options [nop,nop,TS val 2917184646 ecr 225763], length 1208
14:54:16.931967 68:a3:c4:4e:2c:bd > ca:25:e1:20:df:98, ethertype IPv6 (0x86dd), length 86: 2405:204:a40b:b9da:3105:682:a850:44d5.45644 > 2404:6800:4003:805::2003.443: Flags [.], ack 14458, win 490, options [nop,nop,TS val 226007 ecr 2917184646], length 0
14:54:17.014744 ca:25:e1:20:df:98 > 68:a3:c4:4e:2c:bd, ethertype IPv6 (0x86dd), length 1294: 2404:6800:4003:805::2003.443 > 2405:204:a40b:b9da:3105:682:a850:44d5.45644: Flags [P.], seq 14458:15666, ack 925, win 236, options [nop,nop,TS val 2917184646 ecr 225763], length 1208
14:54:17.014798 68:a3:c4:4e:2c:bd > ca:25:e1:20:df:98, ethertype IPv6 (0x86dd), length 86: 2405:204:a40b:b9da:3105:682:a850:44d5.45644 > 2404:6800:4003:805::2003.443: Flags [.], ack 15666, win 509, options [nop,nop,TS val 226027 ecr 2917184646], length 0
14:54:17.051875 ca:25:e1:20:df:98 > 68:a3:c4:4e:2c:bd, ethertype IPv6 (0x86dd), length 1294: 2404:6800:4003:805::2003.443 > 2405:204:a40b:b9da:3105:682:a850:44d5.45644: Flags [.], seq 15666:16874, ack 925, win 236, options [nop,nop,TS val 2917184646 ecr 225763], length 1208
14:54:17.051919 68:a3:c4:4e:2c:bd > ca:25:e1:20:df:98, ethertype IPv6 (0x86dd), length 86: 2405:204:a40b:b9da:3105:682:a850:44d5.45644 > 2404:6800:4003:805::2003.443: Flags [.], ack 16874, win 527, options [nop,nop,TS val 226037 ecr 2917184646], length 0
14:54:17.132684 ca:25:e1:20:df:98 > 68:a3:c4:4e:2c:bd, ethertype IPv6 (0x86dd), length 1286: 2404:6800:4003:805::2003.443 > 2405:204:a40b:b9da:3105:682:a850:44d5.45644: Flags [P.], seq 16874:18074, ack 925, win 236, options [nop,nop,TS val 2917184646 ecr 225763], length 1200
14:54:17.132725 68:a3:c4:4e:2c:bd > ca:25:e1:20:df:98, ethertype IPv6 (0x86dd), length 86: 2405:204:a40b:b9da:3105:682:a850:44d5.45644 > 2404:6800:4003:805::2003.443: Flags [.], ack 18074, win 546, options [nop,nop,TS val 226057 ecr 2917184646], length 0
14:54:17.171876 ca:25:e1:20:df:98 > 68:a3:c4:4e:2c:bd, ethertype IPv6 (0x86dd), length 1294: 2404:6800:4003:805::2003.443 > 2405:204:a40b:b9da:3105:682:a850:44d5.45644: Flags [.], seq 18074:19282, ack 925, win 236, options [nop,nop,TS val 2917184646 ecr 225763], length 1208
14:54:17.171922 68:a3:c4:4e:2c:bd > ca:25:e1:20:df:98, ethertype IPv6 (0x86dd), length 86: 2405:204:a40b:b9da:3105:682:a850:44d5.45644 > 2404:6800:4003:805::2003.443: Flags [.], ack 19282, win 565, options [nop,nop,TS val 226067 ecr 2917184646], length 0
14:54:17.206175 68:a3:c4:4e:2c:bd > ca:25:e1:20:df:98, ethertype IPv6 (0x86dd), length 82: 2405:204:a40b:b9da:3105:682:a850:44d5.8654 > 2001:4860:4860::8844.53: 34655+ A? fb. (20)
14:54:17.206228 68:a3:c4:4e:2c:bd > ca:25:e1:20:df:98, ethertype IPv4 (0x0800), length 62: 192.168.43.197.28131 > 192.168.43.1.53: 34655+ A? fb. (20)
14:54:17.210428 ca:25:e1:20:df:98 > 68:a3:c4:4e:2c:bd, ethertype IPv4 (0x0800), length 62: 192.168.43.1.53 > 192.168.43.197.28131: 34655 NXDomain 0/0/0 (20)
14:54:17.210785 68:a3:c4:4e:2c:bd > ca:25:e1:20:df:98, ethertype IPv6 (0x86dd), length 82: 2405:204:a40b:b9da:3105:682:a850:44d5.16604 > 2001:4860:4860::8844.53: 35011+ AAAA? fb. (20)
14:54:17.211041 68:a3:c4:4e:2c:bd > ca:25:e1:20:df:98, ethertype IPv4 (0x0800), length 62: 192.168.43.197.11808 > 192.168.43.1.53: 35011+ AAAA? fb. (20)
14:54:17.226724 ca:25:e1:20:df:98 > 68:a3:c4:4e:2c:bd, ethertype IPv6 (0x86dd), length 1294: 2404:6800:4003:805::2003.443 > 2405:204:a40b:b9da:3105:682:a850:44d5.45644: Flags [.], seq 19282:20490, ack 925, win 236, options [nop,nop,TS val 2917184646 ecr 225763], length 1208
14:54:17.226769 68:a3:c4:4e:2c:bd > ca:25:e1:20:df:98, ethertype IPv6 (0x86dd), length 86: 2405:204:a40b:b9da:3105:682:a850:44d5.45644 > 2404:6800:4003:805::2003.443: Flags [.], ack 20490, win 584, options [nop,nop,TS val 226080 ecr 2917184646], length 0
14:54:17.266799 ca:25:e1:20:df:98 > 68:a3:c4:4e:2c:bd, ethertype IPv6 (0x86dd), length 1294: 2404:6800:4003:805::2003.443 > 2405:204:a40b:b9da:3105:682:a850:44d5.45644: Flags [.], seq 20490:21698, ack 925, win 236, options [nop,nop,TS val 2917184660 ecr 225763], length 1208
14:54:17.266844 68:a3:c4:4e:2c:bd > ca:25:e1:20:df:98, ethertype IPv6 (0x86dd), length 86: 2405:204:a40b:b9da:3105:682:a850:44d5.45644 > 2404:6800:4003:805::2003.443: Flags [.], ack 21698, win 603, options [nop,nop,TS val 226090 ecr 2917184660], length 0
14:54:17.330780 ca:25:e1:20:df:98 > 68:a3:c4:4e:2c:bd, ethertype IPv6 (0x86dd), length 1294: 2404:6800:4003:805::2003.443 > 2405:204:a40b:b9da:3105:682:a850:44d5.45644: Flags [.], seq 21698:22906, ack 925, win 236, options [nop,nop,TS val 2917184660 ecr 225763], length 1208
14:54:17.330830 68:a3:c4:4e:2c:bd > ca:25:e1:20:df:98, ethertype IPv6 (0x86dd), length 86: 2405:204:a40b:b9da:3105:682:a850:44d5.45644 > 2404:6800:4003:805::2003.443: Flags [.], ack 22906, win 622, options [nop,nop,TS val 226106 ecr 2917184660], length 0
14:54:17.371829 ca:25:e1:20:df:98 > 68:a3:c4:4e:2c:bd, ethertype IPv6 (0x86dd), length 1294: 2404:6800:4003:805::2003.443 > 2405:204:a40b:b9da:3105:682:a850:44d5.45644: Flags [.], seq 22906:24114, ack 925, win 236, options [nop,nop,TS val 2917184704 ecr 225829], length 1208
14:54:17.371888 68:a3:c4:4e:2c:bd > ca:25:e1:20:df:98, ethertype IPv6 (0x86dd), length 86: 2405:204:a40b:b9da:3105:682:a850:44d5.45644 > 2404:6800:4003:805::2003.443: Flags [.], ack 24114, win 641, options [nop,nop,TS val 226117 ecr 2917184704], length 0
14:54:17.375788 ca:25:e1:20:df:98 > 68:a3:c4:4e:2c:bd, ethertype IPv6 (0x86dd), length 86: fe80::c825:e1ff:fe20:df98 > 2405:204:a40b:b9da:3105:682:a850:44d5: ICMP6, neighbor solicitation, who has 2405:204:a40b:b9da:3105:682:a850:44d5, length 32
14:54:17.375859 68:a3:c4:4e:2c:bd > ca:25:e1:20:df:98, ethertype IPv6 (0x86dd), length 78: 2405:204:a40b:b9da:3105:682:a850:44d5 > fe80::c825:e1ff:fe20:df98: ICMP6, neighbor advertisement, tgt is 2405:204:a40b:b9da:3105:682:a850:44d5, length 24
14:54:17.399643 ca:25:e1:20:df:98 > 68:a3:c4:4e:2c:bd, ethertype IPv6 (0x86dd), length 1294: 2404:6800:4003:805::2003.443 > 2405:204:a40b:b9da:3105:682:a850:44d5.45644: Flags [.], seq 24114:25322, ack 925, win 236, options [nop,nop,TS val 2917184704 ecr 225829], length 1208
14:54:17.399692 68:a3:c4:4e:2c:bd > ca:25:e1:20:df:98, ethertype IPv6 (0x86dd), length 86: 2405:204:a40b:b9da:3105:682:a850:44d5.45644 > 2404:6800:4003:805::2003.443: Flags [.], ack 25322, win 660, options [nop,nop,TS val 226124 ecr 2917184704], length 0
14:54:17.457388 ca:25:e1:20:df:98 > 68:a3:c4:4e:2c:bd, ethertype IPv6 (0x86dd), length 1294: 2404:6800:4003:805::2003.443 > 2405:204:a40b:b9da:3105:682:a850:44d5.45644: Flags [.], seq 25322:26530, ack 925, win 236, options [nop,nop,TS val 2917184825 ecr 225901], length 1208
14:54:17.457439 68:a3:c4:4e:2c:bd > ca:25:e1:20:df:98, ethertype IPv6 (0x86dd), length 86: 2405:204:a40b:b9da:3105:682:a850:44d5.45644 > 2404:6800:4003:805::2003.443: Flags [.], ack 26530, win 678, options [nop,nop,TS val 226138 ecr 2917184825], length 0
14:54:17.531822 ca:25:e1:20:df:98 > 68:a3:c4:4e:2c:bd, ethertype IPv6 (0x86dd), length 1294: 2404:6800:4003:805::2003.443 > 2405:204:a40b:b9da:3105:682:a850:44d5.45644: Flags [.], seq 26530:27738, ack 925, win 236, options [nop,nop,TS val 2917184825 ecr 225901], length 1208
14:54:17.531865 68:a3:c4:4e:2c:bd > ca:25:e1:20:df:98, ethertype IPv6 (0x86dd), length 86: 2405:204:a40b:b9da:3105:682:a850:44d5.45644 > 2404:6800:4003:805::2003.443: Flags [.], ack 27738, win 697, options [nop,nop,TS val 226157 ecr 2917184825], length 0
14:54:17.556983 ca:25:e1:20:df:98 > 68:a3:c4:4e:2c:bd, ethertype IPv6 (0x86dd), length 1294: 2404:6800:4003:805::2003.443 > 2405:204:a40b:b9da:3105:682:a850:44d5.45644: Flags [.], seq 27738:28946, ack 925, win 236, options [nop,nop,TS val 2917184860 ecr 225902], length 1208
14:54:17.557032 68:a3:c4:4e:2c:bd > ca:25:e1:20:df:98, ethertype IPv6 (0x86dd), length 86: 2405:204:a40b:b9da:3105:682:a850:44d5.45644 > 2404:6800:4003:805::2003.443: Flags [.], ack 28946, win 716, options [nop,nop,TS val 226163 ecr 2917184860], length 0
14:54:17.595704 ca:25:e1:20:df:98 > 68:a3:c4:4e:2c:bd, ethertype IPv6 (0x86dd), length 1294: 2404:6800:4003:805::2003.443 > 2405:204:a40b:b9da:3105:682:a850:44d5.45644: Flags [.], seq 28946:30154, ack 925, win 236, options [nop,nop,TS val 2917184894 ecr 225920], length 1208
14:54:17.595745 68:a3:c4:4e:2c:bd > ca:25:e1:20:df:98, ethertype IPv6 (0x86dd), length 86: 2405:204:a40b:b9da:3105:682:a850:44d5.45644 > 2404:6800:4003:805::2003.443: Flags [.], ack 30154, win 735, options [nop,nop,TS val 226173 ecr 2917184894], length 0
14:54:17.651818 ca:25:e1:20:df:98 > 68:a3:c4:4e:2c:bd, ethertype IPv6 (0x86dd), length 1294: 2404:6800:4003:805::2003.443 > 2405:204:a40b:b9da:3105:682:a850:44d5.45644: Flags [.], seq 30154:31362, ack 925, win 236, options [nop,nop,TS val 2917184980 ecr 225938], length 1208
14:54:17.651847 68:a3:c4:4e:2c:bd > ca:25:e1:20:df:98, ethertype IPv6 (0x86dd), length 86: 2405:204:a40b:b9da:3105:682:a850:44d5.45644 > 2404:6800:4003:805::2003.443: Flags [.], ack 31362, win 754, options [nop,nop,TS val 226187 ecr 2917184980], length 0
14:54:17.719761 ca:25:e1:20:df:98 > 68:a3:c4:4e:2c:bd, ethertype IPv6 (0x86dd), length 1294: 2404:6800:4003:805::2003.443 > 2405:204:a40b:b9da:3105:682:a850:44d5.45644: Flags [.], seq 31362:32570, ack 925, win 236, options [nop,nop,TS val 2917185020 ecr 225949], length 1208
14:54:17.719817 68:a3:c4:4e:2c:bd > ca:25:e1:20:df:98, ethertype IPv6 (0x86dd), length 86: 2405:204:a40b:b9da:3105:682:a850:44d5.45644 > 2404:6800:4003:805::2003.443: Flags [.], ack 32570, win 773, options [nop,nop,TS val 226204 ecr 2917185020], length 0
14:54:17.745724 ca:25:e1:20:df:98 > 68:a3:c4:4e:2c:bd, ethertype IPv6 (0x86dd), length 1294: 2404:6800:4003:805::2003.443 > 2405:204:a40b:b9da:3105:682:a850:44d5.45644: Flags [.], seq 32570:33778, ack 925, win 236, options [nop,nop,TS val 2917185064 ecr 225967], length 1208
14:54:17.745763 68:a3:c4:4e:2c:bd > ca:25:e1:20:df:98, ethertype IPv6 (0x86dd), length 86: 2405:204:a40b:b9da:3105:682:a850:44d5.45644 > 2404:6800:4003:805::2003.443: Flags [.], ack 33778, win 792, options [nop,nop,TS val 226210 ecr 2917185064], length 0
14:54:17.760492 68:a3:c4:4e:2c:bd > ca:25:e1:20:df:98, ethertype IPv4 (0x0800), length 75: 192.168.43.197.45725 > 192.168.43.1.53: 51718+ A? ssl.gstatic.com. (33)
14:54:17.760639 68:a3:c4:4e:2c:bd > ca:25:e1:20:df:98, ethertype IPv4 (0x0800), length 75: 192.168.43.197.7237 > 192.168.43.1.53: 9940+ AAAA? ssl.gstatic.com. (33)
14:54:17.811850 ca:25:e1:20:df:98 > 68:a3:c4:4e:2c:bd, ethertype IPv6 (0x86dd), length 1294: 2404:6800:4003:805::2003.443 > 2405:204:a40b:b9da:3105:682:a850:44d5.45644: Flags [.], seq 33778:34986, ack 925, win 236, options [nop,nop,TS val 2917185149 ecr 225983], length 1208
